RT,SR,A1,T1,AD,FD,ID,CL,AB,DB,LA,DS
Patent,1,张克杰;韩冰;武志刚;潘蓉,一种硫化镍-石墨烯纳米复合材料的制备方法,211167 江苏省南京市江宁科学园弘景大道1号,2015-12-30,CN105206816A,发明专利,"本发明公开了一种硫化镍-石墨烯纳米复合材料的制备方法,其特征是,包括以下步骤：(1)镍-巯基配合物的制备：将含硫配体与镍盐溶于适量去离子水或有机溶剂中混合反应,搅拌,再依次用有机溶剂、去离子水离心洗涤,收集沉淀,真空干燥得到镍-巯基配合物；(2)烧结体的制备：称取一定量的镍-巯基配合物,置于真空烧结炉中烧结,真空烧结炉中充氮,自然冷却到室温,得到表面附有白色粉末的黑色固体,称此物质为烧结体；(3)酸处理：把烧结体浸于酸溶液中浸泡,过滤,烘干,得到硫化镍-石墨烯纳米复合材料；复合物具有较好的电化学电容特性和荧光特性,电荷传递电阻很小,可用在锂离子电池电极材料、光催化和光电器件的设计上。",中国专利,,CNKI
Patent,1,韩生;王鑫晶;黄燕山;蒋建忠;王驰;蔺华林;于飞;祝俊;余焓;裴素鹏;蒋继波;周祖新;李原婷;邱丰;卢德利,一种碳包覆铁基/石墨烯锂离子电池负极材料及制备方法,200235 上海市徐汇区漕宝路120号,2015-12-30,CN105206817A,发明专利,"本发明公开一种碳包覆铁基/石墨烯锂离子电池负极材料及制备方法。即将氧化石墨烯在水中超声分散均匀后加入铁源,混合均匀后加热回流搅拌,得到二维的金属铁化合物/石墨烯混合液,然后离心所得的沉淀中加入粘合剂聚乙烯醇,用液氮冷冻干燥,得三维有序的复合材料,然后在氮气保护下,控制升温速度为5℃/min升温至400-600℃进行高温煅烧2h,即得三维有序的碳包覆铁基/石墨烯锂离子电池负极材料。该三维有序的碳包覆铁基/石墨烯锂离子电池负极材料具有优异的循环倍率性能、良好的充放电可逆性、良好的循环性能等优点,且制备工艺简单,便于规模化生产。",中国专利,,CNKI
Patent,1,何建新;谭卫琳;韩ﾆ⒚￷;杨勇;连艳平;王利丹;崔世忠;丁彬,一种含有石墨烯、羟基磷灰石和丝素的骨仿生材料的制备方法,451191 河南省郑州市新郑双湖经济技术开发区淮河路1号,2015-12-23,CN105169475A,发明专利,"本发明涉及一种含有石墨烯/羟基磷灰石/丝素的骨仿生材料及其制备方法。它由共沉淀得到的羟基磷灰石经静电吸附组装到羧基化改性的石墨烯表面,再与不同质量浓度的丝素溶液共混按照质量浓度由高到低依次逐层冷冻干燥制备而成。本发明制得的石墨烯/羟基磷灰石/丝素骨仿生材料在成分和结构上仿生天然骨,具有良好的生物相容性和生物可降解性,优良的力学性能以及梯度分布的孔隙率,可以作为骨组织的修复或替代材料,具有广阔的应用前景。",中国专利,,CNKI
Patent,1,张红岭;张慧娟;张振中;陈倩倩;张晓戈,有抗肿瘤药物纳米层的透明质酸修饰的二氧化钛-氧化石墨烯复合材料制备方法及应用,450001 河南省郑州市高新技术开发区科学大道1号,2015-12-30,CN105194679A,发明专利,"本发明涉及有抗肿瘤药物纳米层的透明质酸修饰的二氧化钛-氧化石墨烯复合材料制备方法及应用,有效解决兼具热疗及光动力治疗活性、肿瘤细胞靶向性以及良好生物相容性的HA修饰的Ti-GO纳米复合材料的制备及实现抗肿瘤的治疗用药问题,通过水热法合成二氧化钛-氧化石墨烯纳米材料,然后透明质酸以亚烷基二胺为连接臂和二氧化钛-氧化石墨烯纳米复合材料通过酰胺键化学连接,在水介质中形成纳米层的透明质酸修饰的二氧化钛-氧化石墨烯复合材料,本发明方法制备的有抗肿瘤药物纳米层的透明质酸修饰的二氧化钛-氧化石墨烯复合材料可同时用于肿瘤近红外成像诊断及肿瘤治疗,实现在制备肿瘤近红外成像诊断及肿瘤治疗药物中的应用。",中国专利,,CNKI
Patent,1,魏伟;周如鸿;张艳花;李俊,一种抗菌复合材料氧化石墨烯-三氯生及其制备方法,213022 江苏省常州市新北区河海中路85号,2015-12-23,CN105168249A,发明专利,"本发明公开了一种新型抗菌复合材料,该材料由氧化石墨烯与三氯生按照质量比1～12ﾩU0.5～5,在一定的温度下超声一段时间,然后搅拌,通过用透析或离心的方式除去N,N-二甲基甲酰胺和多余的三氯生,即可得到所述的抗菌复合材料,该复合抗菌材料制备方法简单,而且该材料既改善了三氯生在水系条件下分散性较差的情况,又兼具石墨烯物理性抗菌与三氯生化学性抗菌的能力,从而具备广谱的抗菌能力,潜在应用广泛。",中国专利,,CNKI
Patent,1,高洁;魏大鹏;刘海;杨策;杨俊;孙泰;何庆华;尹军;王莉;王永堂;李森;刘媛;伍亚民,石墨烯眼动片、眼动心理调节仪及眼动测试方法,400042 重庆市渝中区大坪长江支路10号,2015-12-30,CN105193377A,发明专利,"本发明公开了一种石墨烯眼动片,所述石墨烯眼动片包括柔性衬底、设置在柔性衬底上的石墨烯纳米墙和设置在石墨烯纳米墙上的第一电极和第二电极。本发明还公开了一种眼动心理调节仪,包括I/O转换器、下位机、CPLD模块、上位机、LED灯、声音节拍器以及石墨烯眼动片；下位机分别与I/O转换器、CPLD模块、上位机、LED灯、声音节拍器连接,CPLD模块与石墨烯眼动片的第一电极连接,I/O转换器与石墨烯眼动片的第二电极连接,本发明还公开了一种眼动测试方法。本发明能够提供光刺激和节拍器两种激发模式,并能够对眼动反应予以及时分析。",中国专利,,CNKI
Patent,1,温龙平;金佩佩;张云娇;饶照明;魏鹏飞,纳米氧化石墨烯的应用,364000 福建省龙岩市龙岩经济技术开发区曲潭路15号科技创业园创业楼211室,2015-12-30,CN105193846A,发明专利,"本发明公开了一种纳米氧化石墨烯用于预防和治疗神经退行性疾病的应用。本发明首次公开了纳米氧化石墨烯对于细胞自噬和蛋白泛素化的作用机制,为神经退行性疾病的预防和治疗提供了一种新途径。",中国专利,,CNKI
Patent,1,皮德义;尉长虹;张鑫;杜恺;王增奎,一种基于石墨烯传感器的自校正系统,100102 北京市朝阳区望京科技创业园E座513A,2015-12-23,CN105187064A,发明专利,"本发明提供一种基于石墨烯传感器的自校正系统,包括电源、石墨烯传感器、用于将所述石墨烯传感器发生形变的形变信息转换为模拟信号的压电转换电路、用于将所述模拟信号转换为数字信号的模数转换器、以及微控制器；其中,微控制器的一端与模数转换器的输出端连接,另一端与压电转换电路连接,用于依据模数转换器输出的数字信号控制调节压电转换电路的阻值大小,以控制调节模数转换器输出的数字信号满足阈值条件。本发明保证了模数转换器具有最大的动态范围,且使得模数转换器具有最好的线性度,提高了后续电路处理数据的准确性。",中国专利,,CNKI
Patent,1,A·W·李;J·H·亨特;W·R·霍维,包含石墨烯层的触摸屏,美国伊利诺斯州,2015-12-23,CN105190496A,发明专利,"本发明涉及一种触摸屏,其包含导电层和与所述导电层电连接的一个或多个电极,其中,所述导电层包含石墨烯层。在一些实施方式中,所述导电层包含设置在电绝缘性基材上的导电涂层。",中国专利,,CNKI
Patent,1,程新红;郑理;王中健;曹铎;王谦;沈玲燕;张栋梁;俞跃辉,一种基于薄膜半导体-石墨烯异质结的光电探测器制备方法,200050 上海市长宁区长宁路865号,2015-12-30,CN105206689A,发明专利,"本发明提供一种基于薄膜半导体-石墨烯异质结的光电探测器制备方法,包括步骤：首先,提供一衬底,在所述衬底表面两侧生长金属电极；然后在所述衬底及金属电极表面生长薄膜半导体层；接着,去除部分薄膜半导体层,暴露出其中一侧的金属电极以及部分衬底；接着在整个结构表面形成石墨烯层；最后,去除所述薄膜半导体层表面多余的石墨烯层,剩下的石墨烯层与所述薄膜半导体层接触,形成异质结。本发明通过ALD技术生长薄膜半导体与石墨形成异质结作为光电探测器的有源区,该结构可以制备在任意半导体、绝缘体、甚至柔性衬底上,易于硅基集成,且有效节约了工艺成本。",中国专利,,CNKI
Patent,1,王晓伟,含石墨烯颗粒的生物包装材料,266000 山东省青岛市市北区山东路138号,2015-01-07,CN104262980A,发明专利,"含石墨烯颗粒的包装材料,该包装材料是经过如下过程制取的：将选好的废秸秆干燥、粉碎至200目,其它原料粒径在1毫米以内即可；按重量百分比将上述原料在搅拌机内充分混合搅拌3分钟；将混配好的原料,放入模压机内加热160℃、5分钟,制坯；再将坯料粉碎成颗粒熔融成包装用料即可。原料的组成为：废秸秆40-60％；卡拉胶10-15％；聚丙烯树脂5-8％；硬脂酸酯3-7％；石墨烯4-7％。",中国专利,,CNKI
Patent,1,王宗花;史国玉;夏建飞;张菲菲;毕赛;桂日军;杨敏;夏霖;李延辉;夏延致;夏临华,一种Pt/三维石墨烯复合催化剂的制备方法及其应用,266071 山东省青岛市市南区宁夏路308号,2015-01-07,CN104258848A,发明专利,"本发明公开了一种Pt/三维石墨烯复合催化剂的制备方法及其应用。采用一种两性表面活性剂十二烷基氨基丙酸钠辅助合成了Pt/三维多孔石墨烯复合材料(Pt/3D?GN)。研究发现该复合材料中Pt纳米粒子分布均匀且平均粒径较小。电化学测试结果表明,该多孔的Pt/三维石墨烯复合材料具有较高的催化甲醇氧化活性和稳定性,可作为直接甲醇燃料电池的高效阳极催化剂。",中国专利,,CNKI
Patent,1,余家国;许第发;曹少文;程蓓,一种铬酸银-氧化石墨烯复合光催化材料及其制备方法,430070 湖北省武汉市洪山区珞狮路122号,2015-01-07,CN104258857A,发明专利,"本发明涉及一种铬酸银-氧化石墨烯复合光催化材料及其制备方法,该光催化材料由氧化石墨烯和固载在其表面的铬酸银颗粒形成,其制备方法如下：1)制备氧化石墨烯悬浮液；2)制备表面负载有银离子的氧化石墨烯悬浊液；3)制备铬酸银-氧化石墨烯复合光催化材料：将表面活性剂水溶液加入到步骤2)所得的表面负载有银离子的氧化石墨烯悬浊液中,充分搅拌得到混合液,并将铬酸盐水溶液滴加至所得混合液中,所得沉淀物经陈化、后处理得到铬酸银-氧化石墨烯复合光催化材料。本制备方法工序简单、操作方便,所制备的光催化材料比纯铬酸银样品表现出更高的可见光催化活性和稳定性(光化学稳定性和光催化稳定性),具有大规模工业化应用价值。",中国专利,,CNKI
Patent,1,莫尊理;张平;韩立娟;陈芳;朱小波;赵国平;王雅雯;张春;李政,磁响应TiO2纳米管/石墨烯复合材料的制备方法,730070 甘肃省兰州市安宁区安宁东路967号,2015-01-07,CN104258862A,发明专利,"本发明提供了一种磁响应TiO2纳米管/石墨烯复合材料的制备方法,属复合材料领域。本发明利用石墨烯巨大比表面积作为模板,采用水热-共沉淀法使磁性Fe3O4粒子和TiO2纳米管原位负载在石墨烯的片层结构上形成的稳定结构的复合材料。本发明在赋予复合材料一定的磁性能,使其能通过外加磁场对光催化材料进行靶向定位、分离和重复使用,同时使Fe3O4粒子和TiO2纳米的光催化性能产生协同,进一步增强了复合材料的光催化性能,在光催化降解有机废水中具有很好的应用...",中国专利,,CNKI
Patent,1,卢锡洪;王往;曾银香;于明浩;童叶翔,一种大面积制备石墨烯化碳纸的方法及其制备的石墨烯化碳纸,510006 广东省广州市番禺区大学城外环东路132号,2015-01-07,CN104261387A,发明专利,"本发明公开了一种石墨烯化碳纸的制备方法及其制备的石墨烯化碳纸。所述制备方法包括以下步骤：配制浓硫酸和浓硝酸的混合电解液,所述浓硫酸和浓硝酸的用量之比为10～20mL：10～20mL；将石墨纸浸泡到所述混合电解液中进行电化学氧化,所述石墨纸和混合电解液的用量之比为1～3g：20～40mL,然后清洗、干燥,得到氧化石墨烯化碳纸；将所述氧化石墨烯化碳纸置于水合肼中进行还原,得到石墨烯化碳纸。所述制备方法解决了常规方法中石墨烯制备过程中易重聚的问题,从而有效提高了石墨烯的比表面积,适合大规模批量工业生产,可以直接用作超级电容器的电极材料。",中国专利,,CNKI
Patent,1,陈鹏万;尹昊;高鑫;徐春晓;周强,一种冲击波处理碳酸盐制备氮掺杂石墨烯的方法,100081 北京市海淀区中关村南大街5号,2015-01-07,CN104261388A,发明专利,"本发明公开了一种冲击波处理碳酸盐制备氮掺杂石墨烯的方法,属于工艺技术领域。将碳源、还原剂和氮源混合均匀,压实,得到初坯；用飞片撞击样品盒诱发化学反应,得到粉体；将粉体放入反应器中,加入浓硝酸提纯,反应,过滤洗涤,得到固体a,干燥,得到氮掺杂石墨烯。所述氮掺杂石墨烯分子层数为1～6层,氮掺杂量高,具有良好的氧气还原催化活性；所述方法成本低、生产周期短、工艺简单便于可工业化生产、对生产条件要求低、生产过程中不易出现危险。",中国专利,,CNKI
Patent,1,张小英,一种石墨烯及其制备方法、应用,215000 江苏省苏州市高新区国际教育园北区学府路287号,2015-01-07,CN104261389A,发明专利,"本发明公开了一种石墨烯及其制备方法、应用,所述的石墨烯的制备方法包括以下步骤：(1)取二氧化硅片,分别用丙酮、乙醇进行进行超声清洗；(2)通过磁控溅射的方式将铜镍合金溅射在二氧化硅片上；(3)将溅射上铜镍合金的二氧化硅片用丙酮和乙醇溶液再次超声清洗,然后烘干；(4)将管式炉温度设定为850℃-950℃,将步骤(3)烘干后的衬底放入管式炉中,通氩气；(5)温度稳定后,向管式炉中注射乙炔；(6)将管式炉温度降低至室温；(7)从管式炉中取出样品,超声清洗后制备得到石墨烯。",中国专利,,CNKI
Patent,1,赵建国;邢宝岩;屈文山;古玲;王海青,一种以植物绿叶与石灰石为原料制备石墨烯的方法,037009 山西省大同市御东新区兴云街山西大同大学,2015-01-07,CN104261390A,发明专利,"一种以植物绿叶与石灰石为原料制备石墨烯的方法是将植物绿叶粉末和碳酸钙粉末混合研磨,在氩气的保护下高温焙烧,石灰石热分解释放的二氧化碳被叶绿素中的镁原位还原后得到石墨烯。本发明可以大幅度降低制备成本,工艺安全性高,是一种绿色环保的低碳节能生产工艺。",中国专利,,CNKI
Patent,1,相田卓三;朴致映;赛斯万·拉维;松本道生,新型石墨烯纳米分散液及其制备方法,日本东京都,2015-01-14,CN104284890A,发明专利,"本发明的目的在于提供能够使石墨烯以高浓度分散的新型离子液体。本发明涉及下述通式(1)所表示的离子液体。(1)(式中,R1和R5可以相同也可以不同,各自独立地表示取代或无取代的C1～C7直链或支链烷基；R2由下式表示,(2)此处,R6和R7可以相同也可以不同,各自独立地表示C1～C4的直链或支链亚烷基,m表示1～5的整数；R3和R4可以相同也可以不同,各自独立地表示氢原子、取代或无取代的C1～C4的直链或支链烷基；X-表示...",中国专利,,CNKI
Patent,1,高超;寇亮;刘峥,一种自支撑的石墨烯水凝胶膜及其制备方法,310003 浙江省杭州市西湖区西溪路525号C楼715室,2015-01-07,CN104261391A,发明专利,"本发明公开了一种自支撑的石墨烯水凝胶膜及其制备方法。它包括以下步骤：1)将1重量份的氧化石墨烯,50-200重量份的水混合,超声分散后得到氧化石墨烯的水分散液；2)将步骤1)得到的氧化石墨烯的水分散液,以10～1000mL/h的挤出速度在一字形模口的装置中挤出到凝固液中,凝固成氧化石墨烯水凝胶膜；3)将1重量份的步骤2)得到的氧化石墨烯水凝胶膜用1～200重量份的还原剂,进行化学还原,用水清洗后得到自支撑的石墨烯水凝胶膜。本发明方法简便、工艺简单、能耗低、绿色环保,所获得的自支撑的石墨烯凝胶膜柔韧性好,强度高,厚度、尺寸均可以调节,微结构规整,可以应用于生物载药、催化等领域。",中国专利,,CNKI
Patent,1,徐春祥;田正山;理记涛;朱刚毅;吴靖;石增良,一种硼酸根离子交联的导电石墨烯纸的制备方法,211189 江苏省南京市江宁区东南大学路2号,2015-01-07,CN104261392A,发明专利,"本发明公开了一种硼酸根离子交联的导电石墨烯纸的制备方法,采用改进的Hummers法制备氧化石墨,并在去离子水中超声剥离得到氧化石墨烯水溶胶；然后,在氧化石墨烯水溶胶中加入氢氧化钠溶液调节pH至10～12,再加入硼酸,在搅拌的条件下加热至80～90℃,保温3～5h,后自然冷却,分离,洗涤,超声分散于去离子水中,最后通过微孔滤膜过滤层层自组装得到硼酸根离子交联的石墨烯纸。本发明制备方法简单,操作方便,无需特殊的设备,并且成本低廉,容易批量生产。得到的石墨烯纸具有优良的导电性能,该导电石墨烯纸有可能成为应用于光电子器件的理想导电材料。",中国专利,,CNKI
Patent,1,马琦;宋金萍;郭永;双少敏;董川,一种以盐酸胍为还原剂的石墨烯制备方法,037009 山西省大同市御河桥东,2015-01-07,CN104261393A,发明专利,"本发明要涉及一种以盐酸胍为还原剂的石墨烯制备方法,(1)将氧化石墨烯分散于水中,得到均匀分散的氧化石墨烯分散液。(2)将可溶性高分子聚合物加入到氧化石墨烯分散液中,得到高分子聚合物与氧化石墨烯的混合溶液。(3)将盐酸胍加入到步骤(2)所得的混合溶液中,盐酸胍与氧化石墨烯的质量比为10∶1～100∶1,同时加入碱性溶液调节pH至8～12,置于油浴锅中搅拌反应,油浴温度为60～100℃,搅拌反应时间为1～5小时,随后经离心、洗涤即得所述水溶性石墨烯。本发明制备工艺简单,设备要求低,易于大批量制备石墨烯,由此制备的石墨烯可用于构建传感器及电学器件。",中国专利,,CNKI
Patent,1,张麟德;张明东,石墨烯的制备方法,518107 广东省深圳市光明新区观光路3009号招商局光明科技园A3栋C单元501,2015-01-07,CN104261394A,发明专利,"本发明涉及一种石墨烯的制备方法,包括将表面活性剂加入碳酸酯类溶剂中,配制含有表面活性剂的溶液,表面活性剂选自四甲基碳酸氢铵、四乙基碳酸氢铵、四丁基碳酸氢铵、十二烷基四甲基碳酸胍及十六烷基四甲基碳酸胍中的至少一种；将石墨加入含有表面活性剂的溶液中,进行超声剥离后离心,得到含有石墨烯的上清液；将含有石墨烯的上清液于80℃～100℃下保温0.5h～1h,过滤、干燥得到石墨烯粉体粗品；及在保护气体氛围中,将石墨烯粉体粗品于200℃～300℃下保温0.5h～1h得到石墨烯粉体的步骤。该方法能防止石墨烯上残留表面活性剂与溶剂,使助剥离剂和溶剂的残留较少,且石墨烯的片层尺寸为3μm～50μm,片层尺寸较大。",中国专利,,CNKI
Patent,1,罗静;赖健平;刘仁;刘雁冰;刘晓亚,一种三维石墨烯-植物多酚复合材料的制备方法,214122 江苏省无锡市蠡湖大道1800号,2015-01-07,CN104261397A,发明专利,"本发明提供一种三维石墨烯-植物多酚复合材料的制备方法,所述制备方法包括如下步骤：(1)在室温下,将一定量的氧化石墨烯和植物多酚加入水中,超声分散形成前驱体溶液；(2)在不搅拌的情况下,将前驱体溶液加热到80℃以上反应一段时间,反应结束后,冷却至室温,取出产物。本发明工艺简单,便于操作,反应条件较温和,并且省略了现有技术中常用的有毒有害的还原剂,原料易得,成本低廉,适合低成本、大规模工业化生产。本发明制备的三维石墨烯-植物多酚复合材料富含大孔与介孔结构,比表面积大,又因植物多酚的修饰,该复合材料亲水性、生物相容性好,并且其表面保留了很多酚羟基,便于进一步加以利用,对重金属离子具有较强的吸附性能。",中国专利,,CNKI
Patent,1,纪玉信;张树鸿;孙成华,一种用于制备石墨烯的原料及其制备方法,523583 广东省东莞市常平镇袁山贝兴利工业区,2015-01-07,CN104261398A,发明专利,"本发明涉及一种用于制备石墨烯的原料,其由原料混合液制成,所述原料混合液包括按照质量百分数计的如下组分：石墨20-50％；羧甲基纤维素钠0.1-2％；吐温0.1-1％；氨水2-5％；亚甲基二萘磺酸钠0.3-3％；阿拉伯胶0.5-10％；余量为水。本发明还提供该用于制备石墨烯的原料的制备方法,其现将原料混合,然后高速搅拌,然后经球磨机循环珠磨,然后经离心、凝析、压滤,获得产品。本发明的用于制备石墨烯的原料的粒子粒度细、粒径均匀；此外,本发明的制备方法,产率高、生产成本低,较传统方法的产出率高出50％以上。",中国专利,,CNKI
Patent,1,钱景;赵兵,一种氧化石墨烯的还原方法,215000 江苏省苏州市相城区元和街道御窑路与安元路交汇处康桥溪岸花园5幢2101,2015-01-07,CN104261400A,发明专利,"本发明涉及一种氧化石墨烯的还原方法,按10:1-1:1的体积比,将市面上可以出售的芦荟胶配置成0.1-100g/L的水溶液,与质量分数0.01-0.5g/L的氧化石墨烯溶液混合,在20℃-80℃的温度条件下搅拌1-48h,得到石墨烯溶液,用乙醇和去离子水反复清洗,离心,干燥处理后得到石墨烯粉末。本发明直接采用市面上可以出售的芦荟胶作为还原剂,具备工艺简单、原料来源广泛、反应温和、绿色环保等优点。",中国专利,,CNKI
Patent,1,钱景;赵兵,一种石墨烯的制备方法,215000 江苏省苏州市相城区元和街道御窑路与安元路交汇处康桥溪岸花园5幢2101,2015-01-07,CN104261401A,发明专利,"本发明涉及一种石墨烯的制备方法,按10:1-1:1的体积比,将市面上可以出售的饮料与质量分数0.01-10g/L的氧化石墨烯溶液混合,在20℃-80℃的温度条件下搅拌30-600min,得到石墨烯溶液,用乙醇和去离子水反复清洗,离心,干燥处理后得到石墨烯粉末。本发明直接采用市面上可以出售的果汁类饮料、茶类饮料作为还原剂,不需要繁琐的提取植物及其果皮活性物的过程,具备工艺简单、原料来源广泛、反应温和、绿色环保等优点。",中国专利,,CNKI
Patent,1,庄华杰;汪伟;刘兆平;陈黎,一种石墨烯的转移方法,315201 浙江省宁波市镇海区中官西路1219号,2015-01-07,CN104261402A,发明专利,"本发明提供了一种石墨烯的转移方法,包括以下步骤：1)将沉积有石墨烯的衬底置于含有氧化性物质的介质中处理；2)将所述步骤1)处理后的衬底中沉积有石墨烯的一侧与目标基体粘结；3)将所述步骤2)得到的样品中的衬底剥离,完成石墨烯的转移。本发明提供的方法首先将沉积有石墨烯的衬底置于氧化性介质中处理,降低了石墨烯与衬底之间的界面结合力,从而使得后期在剥离衬底时石墨烯容易由衬底表面脱落,不会损坏石墨烯的完整性,转移到目标基体上的石墨烯无破损,且石墨烯缺陷较小。",中国专利,,CNKI
Patent,1,郑玉婴;汪晓莉,一种三维多孔结构石墨烯的制备方法,350108 福建省福州市闽侯县上街镇大学城学园路2号福州大学新区,2015-01-07,CN104261403A,发明专利,"本发明提供了一种三维多孔结构石墨烯的制备方法,以聚苯乙烯模板与氧化石墨烯间的静电作用形成均匀的分散液,然后通过高温煅烧除去聚苯乙烯模板,热还原得到三维多孔结构的石墨烯。本发明以聚苯乙烯小球作为模板,通过控制聚苯乙烯小球粒径的大小,可有效控制石墨烯中的孔径大小；而通过煅烧还原法制备石墨烯可以避免化学还原过程中使用的有毒化学试剂以及石墨烯团聚问题,同时煅烧后的石墨烯的孔状结构更加牢固。",中国专利,,CNKI
Patent,1,施伟东;蔡凡朋;闫研;唐玉斌,一种类石墨烯状硅化镁纳米片的制备方法,212013 江苏省镇江市京口区学府路301号,2015-01-07,CN104261411A,发明专利,"本发明属于半导体材料制备技术领域,特别涉及一种类石墨烯状硅化镁纳米片的制备方法。该方法以氧化石墨烯为模板,硅酸正乙酯,氨水、蒸馏水与乙醇的混合溶液为溶剂,利用溶胶-凝胶法、煅烧除模板,制得新型类石墨烯状硅化镁纳米片材料。",中国专利,,CNKI
