RT,SR,A1,T1,AD,FD,ID,CL,AB,DB,LA,DS
Patent,1,王雄伟;张泽汇;武培怡,碳包氧化镍纳米片负载在石墨烯上的纳米复合材料及其制备方法,200433 上海市杨浦区邯郸路220号,2015-12-09,CN105140464A,发明专利,"本发明属于储能材料技术领域,具体为一种碳包NiO纳米片负载在石墨烯上的纳米复合材料及其制备方法。本发明通过简单的一步溶剂热法制备得到无定形碳包覆的氧化镍纳米片原位均匀生长在石墨烯上的纳米复合材料。这种纳米复合材料具有高的比表面积以及孔隙率,可用作锂电池的负极材料,在200mA/g电流密度下表现出高的储能密度和良好的多次充放电稳定性；此外,这种复合材料在高电流密度下依然能够保持较高的储能密度,当电流密度回复到低值时储能密度同样可以回复到较高水平。本发明方法,操作简单,生产成本较低,易于批量化、规模化生产,具有良好的工业化生产基础和广阔的应用前景。",中国专利,,CNKI
Patent,1,梁亚青;廖运平;闵凡奇;刘正,一步法制备无粘结剂的石墨烯电极的方法及所用装置,201199 上海市闵行区新源路1356弄1-7号汇力得产业园C307室,2015-12-09,CN105140465A,发明专利,"本发明公开了一种用于制备无粘结剂的石墨烯电极的装置,包括槽体,槽体内设有阴极室和带搅拌器的阳极室,阴极室和阳极室之间通过多孔性绝缘隔板隔开；还包括可置于阴极室内的阴极片和可置于阳极室内的阳极片,所述阴极片和阳极片通过各自的导线连接至物理电源,阴极片还通过步进机导杆连通步进机。本发明还公开了一步法制备无粘结剂的石墨烯电极的方法。本发明的装置可在常温下进行一步法制备嵌锂的石墨烯电极片,避免了传统电极制备过程中粘结剂的使用,节省了材料成本。所用方法比传统制备方法节省时间,而且对电极层的厚度可控,加上所用装置结构简单、成本较低,具有工业化生产的潜力。",中国专利,,CNKI
Patent,1,蒋仲杰;江宇;刘美林,一种蛋黄结构过渡金属氧化物/石墨烯复合材料及其制备方法与应用,510006 广东省广州市番禺区广州大学城华南理工大学,2015-12-09,CN105140469A,发明专利,"本发明属于无机非金属材料和电化学领域,公开了一种蛋黄结构过渡金属氧化物/石墨烯复合材料及其制备方法与应用。所述方法为：(1)将过渡金属氧化物颗粒和去离子水加入醇中,超声分散,加入正硅酸乙酯和氨水溶液,于20～50℃反应3～8h,加入3-氨丙基三乙氧基硅烷,搅拌混匀,置于水热釜内进行水热反应,洗涤,干燥,得到表面改性的过渡金属氧化物；(2)将表面改性的过渡金属氧化物分散于去离子水中,在搅拌的条件下,调节分散液的pH,加入氧化石墨烯溶液,搅拌混匀,置于水热釜内进行水热反应,置于强碱溶液中,搅拌反应,离心洗涤,干燥,得到蛋黄结构过渡金属氧化物/石墨烯复合材料。所制备的材料具有较好的电化学性能。",中国专利,,CNKI
Patent,1,曾宪武;曾洪华,一种镍钴锰酸锂/石墨烯/碳纳米管复合正极材料及其制备方法,518000 广东省深圳市龙华新区大浪街道同胜社区华荣路龙富工业区3栋厂房1-3层,2015-12-09,CN105140493A,发明专利,"本发明公开了一种镍钴锰酸锂/石墨烯/碳纳米管复合正极材料及制备方法。复合正极材料由LiNi1/3Co1/3Mn1/3O2、Graphene和CNTs组成,Graphene与CNTs所占的质量百分百含量为0.1%~20%,Graphene与CNTs的质量比为10:1~1:10；其制备方法为：以Graphene与CNTs的稳定悬浊液,镍、钴、锰的乙酸盐或硝酸盐及碳酸锂为原料,通过流变相法制备镍钴锰酸锂/石墨烯/碳纳米管复合正极材料。本发明的镍钴锰酸锂/石墨烯/碳纳米管复合正极材料具有放电比容量高,倍率性能好,制...",中国专利,,CNKI
Patent,1,侯宏英;刘松;刘显茜;段继祥;孟瑞晋,一种石墨烯/铜复合电极材料的应用,650093 云南省昆明市五华区学府路253号,2015-12-09,CN105140497A,发明专利,"本发明涉及一种石墨烯/铜复合电极材料的应用,属于新能源材料的开发与研究领域。本发明通过一步电沉积法在金属铜表面自组装一层石墨烯活性物质,然后在充满高纯氩气的手套箱内与锂箔组装成扣式模拟锂离子电池,并以恒流充/放电的方法测试其充/放电性能及循环稳定性能。本发明通过自组装方法使金属铜与石墨烯活性物质巧妙而紧密地结合在一起,该电极材料不仅比表面积大,而且与铜集流体结合紧密,有助于减小接触电阻。与传统涂覆式电极制备工艺相比,该工艺操作简单,环境友好,易于放大,且有助于缓解活性物质在长期充/放电过程中的脱落现象,并提高了锂离子电池的充/放电性能与循环稳定性能。",中国专利,,CNKI
Patent,1,陈飞;张慧;郭志刚;何英;班涛伟,一种包含铅-石墨烯复合材料的铅蓄电池板栅,313100 浙江省湖州市长兴县煤山工业园,2015-12-09,CN105140524A,发明专利,"本发明公开了一种包含铅-石墨烯复合材料的铅蓄电池板栅,板栅的配方以重量百分比计,组成为：锡0.01～1.0％、铅-石墨烯复合材料0.5～10.0％、铅为余量,所述的铅-石墨烯复合材料利用复合电镀技术制备得到。制得的铅-石墨烯复合材料的密度比石墨烯大,可作为添加剂直接与其他金属混合,制得合金,保证石墨烯均匀地分布在合金内部,克服了石墨烯密度低,与其他金属混合不均匀的缺陷。利用铅-石墨烯复合材料制得铅蓄电池板栅的硬度、抗蠕变性能、耐腐蚀性能都得到显著提高。",中国专利,,CNKI
Patent,1,何春年;秦戬;赵乃勤;师春生;刘恩佐;李家俊,三维石墨烯层间填充碳包覆锡颗粒的复合材料及制备,300072 天津市南开区卫津路92号,2015-12-16,CN105161721A,发明专利,"本发明公开了一种三维石墨烯层间填充碳包覆锡颗粒的复合材料及制备方法。该材料由碳包覆锡纳米颗粒均匀填充到石墨烯片层中,组成三维三明治状结构。其制备过程如下：采用NaCl作为分散剂和模板,将其与金属源和碳源充分溶解混合,冷冻干燥并研细,得到混合物；将混合物放入管式炉,于氩气保护下煅烧,得到煅烧产物；将煅烧产物洗涤,与无水葡萄糖混合进行水热包覆,将水热产物再进行氢气催化煅烧,得到三维石墨烯层间填充碳包覆锡颗粒的复合材料。本发明优点在于,制备过程安全无害,操作简单,所制备的三维石墨烯层间填充碳包覆锡颗粒的复合材料作为锂离子电池负极材料具有高可逆容量,强循环稳定性以及优异的倍率性能。",中国专利,,CNKI
Patent,1,容敏智;陈家怡;章明秋,一种微生物燃料电池阳极用石墨烯水凝胶复合物及其制备方法和应用,510275 广东省广州市新港西路135号,2015-12-09,CN105140534A,发明专利,"本发明提供了一种微生物燃料电池阳极用石墨烯水凝胶复合物,包括以下重量分数的原料反应获得：含亲水性基团的乙烯基单体30~40份；氧化石墨烯8~15份；水溶性自由基引发剂1~1.5份；含亲水性基团的双乙烯基单体0.1~0.5份；还原剂8~15份。该材料结合了石墨烯优异的力学性能和电导率及水凝胶良好的生物相容性,以其为阳极所构成的微生物燃料电池,可在纯化污水的同时,利用细菌作为催化剂,直接将有机物(或无机物)中化学键储存的化学能转化为电能。该材料良好的生物相容性能吸引大量产电菌附着,从而延长产电周期,提高产电效率。",中国专利,,CNKI
Patent,1,朱桂林,基于石墨烯透明导电膜的柔性LED灯带,215151 江苏省苏州市高新区浒关浒杨路88号,2015-12-16,CN105156932A,发明专利,"本发明公开了一种基于石墨烯透明导电膜的柔性LED灯带,其由若干柔性层组成,所述柔性层依次包括,柔性透明面板,其设于外层；柔性电致发光光源层,相邻于所述柔性透明面板一侧,所述柔性电致发光光源层为石墨烯透明导电膜,与所述柔性透明面板相邻一侧的所述柔性电致发光光源层上设有若干LED灯珠；以及,柔性电致背光胶层,设于所述柔性电致发光光源层另一侧；所述柔性透明面板、柔性电致发光光源层、柔性电致背光胶层及软性线路板经压合形成一体结构。本案提供的基于石墨烯透明导电膜的柔性LED灯带可实现LED路灯结构的多元化,更进一步地,实现LED路灯使用的多样化。",中国专利,,CNKI
Patent,1,史明鹏;吴海英;孙曙光;吴鸣良,含石墨烯的架空绝缘电缆用交联聚乙烯绝缘材料的电缆,214242 江苏省宜兴市西郊工业园振丰东路999号,2015-12-16,CN204884602U,实用新型,"本实用新型公开了一种含石墨烯的架空绝缘电缆用交联聚乙烯绝缘材料的电缆,要解决的技术问题是降低架空绝缘电缆成本。本实用新型采用以下技术方案：一种含石墨烯的架空绝缘电缆用交联聚乙烯绝缘材料的电缆,导体外包覆有绝缘层,所述绝缘层的厚度减薄5～10％。本实用新型与现有技术相比,在交联聚乙烯绝缘材料中添加有石墨烯和氧化石墨烯,配合辅助导热剂,提高了架空绝缘电缆绝缘层的导热率、耐紫外线性能和耐候性能,使得绝缘层的性能更加优异,相比现有技术的绝缘层,架空绝缘电缆绝缘层厚度可减薄5～10％,大大降低了架空绝缘电缆的成本,降低了架设电缆施工的难度。",中国专利,,CNKI
Patent,1,靳涛;孔作万;简瑜,一种采用石墨烯散热材料制作的LED灯具,523000 广东省东莞市常平镇南埔科技创新中心B栋三层,2015-12-09,CN204853406U,实用新型,"本实用新型公开了一种采用石墨烯散热材料制作的LED灯具,包括LED灯及灯罩,LED灯下端设置有导热柱,导热柱上端设置有沉孔,沉孔内设置有安装平面；沉孔上设置有灯罩,LED灯位于灯罩内；导热柱的外侧圆柱面上垂直均布有多个散热片,散热片为矩形状；导热柱下方设置有放置散热底座的腔体,散热底座与安装平面中部位置对应设置有LED安装孔,LED灯安装与LED安装孔内；散热底座与安装平面均设置有安装孔；散热底座底部竖直均布有多组散热锥台,散热底座、散热锥台、导热柱及散热片均采用石墨烯导热材料制作而成。本新型结构简单紧凑,设计合理,重量轻,绝缘性能好,生产成本低,具有良好的散热性能,大大提高了LED灯的使用寿...",中国专利,,CNKI
Patent,1,刘天西;黄云鹏;缪月娥;张由芳;赖飞立;鲁恒毅,一种碳纳米纤维-石墨烯复合气凝胶及其协同组装制备方法,200433 上海市杨浦区邯郸路220号,2015-12-16,CN105161312A,发明专利,"本发明属于纳米纤维碳气凝胶领域,具体为一种碳纳米纤维-石墨烯复合气凝胶及其协同组装制备方法。本发明方法包括：采用静电纺丝法制备聚丙烯腈纳米纤维；通过程序控温预氧化处理,制备出表面功能化的氧化聚丙烯腈纳米纤维；对氧化聚丙烯腈纳米纤维进行匀浆处理,然后在一定条件下将其和氧化石墨烯进行协同组装,经过冷冻干燥处理和高温碳化制备碳纳米纤维-石墨烯复合气凝胶。本发明制备过程简单高效,绿色环保,无任何有毒试剂的使用,且所制得的碳纳米纤维-石墨烯复合气凝胶具有质轻、多孔、回弹性良好等优点,解决了传统膜状静电纺丝纤维材料不易三维成型的难题。本发明所制备的碳纳米纤维-石墨烯复合气凝胶作为超级电容器电极材料具有优异...",中国专利,,CNKI
Patent,1,文婕;李云涛;赵春霞;邢云亮;冷帅,纳米氧化镍/镍/石墨烯复合材料及其制备方法和应用,610500 四川省成都市新都区新都大道8号,2015-12-16,CN105161314A,发明专利,"本发明涉及一种用于超级电容器的纳米氧化镍/镍/石墨烯复合材料及制备方法,属于纳米复合材料和电化学领域。本发明提供一种纳米氧化镍/镍/石墨烯复合材料,其结构为：石墨烯表面均匀分布有纳米氧化镍和金属镍颗粒。本发明的材料利用石墨烯的特性,克服NiO作为超级电容器材料存在的缺陷,制备出高容量,稳定性好,绿色环保的适用于超级电容器的氧化镍/镍/石墨烯复合材料。",中国专利,,CNKI
Patent,1,朱俊武;孙欢;汪信;付永胜;丁静;孟晓茜,一种快速制备硫化钴/石墨烯水凝胶纳米复合材料的方法,210094 江苏省南京市孝陵卫200号,2015-12-16,CN105161317A,发明专利,"本发明公开了制备硫化钴/石墨烯水凝胶纳米复合材料的方法,包括以下步骤：将氧化石墨烯搅拌分散于异丙醇溶液中制得分散液；将分散液、CoCl2水溶液、Na2S水溶液依次置于容器中得到反应液,再置于密闭反应釜中,于100～220℃下恒温反应；将所得的产物洗涤即得所述复合材料。本发明所述制备方法简单,测试方便,无需加入任何粘结剂；且很好地结合了石墨烯与硫化钴的优点,利用二者间的协同作用,继承了石墨烯较大的比表面积,有效抑制了石墨烯片层的堆叠与硫化钴纳米粒子的团聚现象,进一步提高材料的电化学性能。",中国专利,,CNKI
Patent,1,蔺华林;黄奇;刘凡;熊丽萍;何忠义;韩生;常兴;周嘉伟;艾亚妮;王鑫晶;马鹏;储磊;刘益林;李飞;王驰;杭智军,一种三维石墨烯/四氧化三钴复合材料及其制备方法和应用,200235 上海市徐汇区漕宝路120号,2015-12-16,CN105161318A,发明专利,"本发明公开一种三维石墨烯/四氧化三钴复合材料及制备方法,所述三维石墨烯/四氧化三钴复合材料由石墨烯和四氧化三钴组成,具有三维微米或三维纳米的多孔结构,四氧化三钴均匀的分布在石墨烯表面上。其制备方法即首先制备氧化石墨烯分散液、二价钴盐分散液,然后将氧化石墨烯分散液和二价钴盐分散液混合并超声分散均匀,所得氧化石墨烯/二价钴盐混合液油浴控温后离心、洗涤,再加入氧化石墨烯超声分散均匀,得到的氧化石墨烯/氢氧化钴混合液水热反应,得到的石墨烯/四氧化三钴水凝胶依次经预冻、冻干即得比容量高达748F/g,循环和倍率性能好的三维石墨烯/四氧化三钴复合材料。其制备方法简单可靠、成本低廉、环保。",中国专利,,CNKI
Patent,1,邱介山;孟祥桐;于畅,一种硒掺杂石墨烯对电极及其制备方法,116024 辽宁省大连市高新园区凌工路2号,2015-12-09,CN105140038A,发明专利,"本发明涉及碳材料的制备与应用技术领域,一种硒掺杂石墨烯对电极及其制备方法,包括以下步骤：1、将氧化石墨烯和硒粉作为前驱体,经过机械球磨混合；2、将步骤1所得混合物在惰性气氛下高温退火处理,冷却至室温,制得硒掺杂石墨烯材料；3、将步骤2得到的硒掺杂石墨烯材料与粘结剂研磨均匀,再将所得浆料涂覆到绝缘基底的导电层上；4、在惰性气氛保护下,将步骤3得到的涂覆有浆料的绝缘基底,升温退火处理,冷却至室温后,得到目标对电极。本发明采用的制备工艺简单、原料成本低、适于大批量工业化制备；与传统铂对电极相比,所制备的硒掺杂石墨烯对电极对电解质具有优良的电催化活性和电化学稳定性,因而,有望取代资源短缺、价格昂贵及稳...",中国专利,,CNKI
Patent,1,花秀夫;张天,一种基于石墨烯聚吡咯的赝电容超级电容器的电极材料,710000 陕西省西安市高新区锦业路69号C区1号瞪羚谷F栋501室,2015-12-09,CN105140045A,发明专利,"本发明公开了一种基于石墨烯聚吡咯的赝电容超级电容器的电极材料,将氧化石墨在蒸馏水中超声分散0.5-1h,然后加入聚苯乙烯磺酸钠在60-80℃下反应1-2h,冷却过滤后加入水合肼在100℃下反应1h,冷却后过滤洗涤得到石墨烯纳米片；采用分子吸附的方法将吡咯吸附于石墨烯纳米片上,并分散于盐酸的水溶液中,滴加氯化铁溶液在0-4℃条件下反应4-6h后洗涤干燥得到石墨烯聚吡咯的赝电容超级电容器的电极材料。本发明制备了一种同时具有导电性好、比表面积大、化学稳定性好的赝电容超级电容器电极材料,并表现出极佳的电容性能。",中国专利,,CNKI
Patent,1,汪形艳;唐熠;戴友芝;陈艳波;杨秋月,一种纳米γ-MnO2/石墨烯气凝胶复合材料的制备方法及其应用,411105 湖南省湘潭市西郊羊牯塘,2015-12-09,CN105140046A,发明专利,"本发明公开了一种纳米γ-MnO2/石墨烯气凝胶复合材料的制备方法及其应用,复合材料的制备方法是：先通过改进的Hummers法制备氧化石墨；再以氧化石墨为原料通过微波消解还原制备石墨烯气凝胶；最后通过液相沉积在石墨烯气凝胶表面沉积γ-MnO2,得到纳米γ-MnO2/石墨烯气凝胶复合材料。制得的纳米γ-MnO2/石墨烯气凝胶复合材料具有良好电容性能,可以用作超级电容器电极材料,且制备流程简单、反应条件温和、对环境友好、成本低、满足工业生产要求。",中国专利,,CNKI
Patent,1,曲莱;曲少忠,一种石墨烯纳米金属导电高分子聚合物层叠结构复合锂电池负极及其制备方法,518060 广东省深圳市南山区蛇口荣村工业区D栋伟百富大厦2楼231室,2015-12-16,CN105161674A,发明专利,"本发明公开了一种石墨烯纳米金属导电高分子聚合物层叠结构复合锂电池负极及其制备方法,包括非氧化石墨烯平直片、片状纳米金属、片状纳米合金和导电高分子聚合物；所述片状纳米金属和所述片状纳米合金至少包含一种,所述片状纳米金属的金属组分为一种或多种,所述片状纳米合金的合金组分为一种或多种,所述非氧化石墨烯平直片、片状纳米金属、片状纳米合金之间填充有导电高分子聚合物材料,形成一种层叠式结构。本发明的优点在于：提供了一种层间加边缘再加隙间的多维的流动,易于锂离子嵌入脱出,是以纳米材料进行微观组装成微米级(5—15μm)结构的高性能锂电池负极材料。",中国专利,,CNKI
Patent,1,金波;钟晓斌;郎兴友;朱永福;高旺;杨春成;文子;李建忱;赵明;于开锋;蒋青,通过掺杂石墨烯和二氧化钛提高二硫化钼充放电循环能力的方法,130012 吉林省长春市前进大街2699号,2015-12-16,CN105161690A,发明专利,"本发明公开了一种通过掺杂石墨烯和二氧化钛提高二硫化钼充放电循环能力的方法,所述的二硫化钼/二氧化钛/石墨烯复合材料以石墨烯作为导电改性相、二氧化钛作为支架和协同相,以此增强该复合材料的充放电循环性能。选用钼酸钠、硫脲、氧化石墨、四异丙醇钛、无水乙醇、醋酸、聚乙烯吡咯烷酮和去离子水,静电纺丝、水热反应后,经真空干燥得到二硫化钼/二氧化钛/石墨烯复合材料。该法生产工艺简单、成本低、所制得的二硫化钼/二氧化钛/石墨烯具有优良的电化学性能。",中国专利,,CNKI
Patent,1,马琳;许丽梅;徐旭耀;周晓平;罗金;张玲玲,一种少层数MoS2/磷掺杂石墨烯电化学储钠复合电极的制备方法,524048 广东省湛江市赤坎区寸金路29号,2015-12-16,CN105161691A,发明专利,"本发明公开了一种少层数MoS2/磷掺杂石墨烯电化学储钠复合电极的制备方法。所述方法包括如下步骤：S1.将氧化石墨烯分散在水中,加入季膦盐混匀,再依次加入钼酸盐和硫源,混匀；S2.将S1得到的混合分散体系进行水热反应,冷却,离心收集固体产物,洗涤,干燥,再在氩气或氮气气氛中进行热处理,制备得到少层数MoS2/磷掺杂石墨烯复合纳米材料；S3.将S2得到的复合纳米材料作为电化学贮钠活性物质制得所述复合电极。本发明以氧化石墨烯、钼酸盐和硫源为原料,通过季膦盐协助的水热和热处理等方法成功地制备出少层数MoS2/磷掺杂石墨烯电化学储钠复合电...",中国专利,,CNKI
Patent,1,赵金保;杨阳,一种锂离子电池用硅-碳-石墨烯复合负极的制备方法,226300 江苏省南通市高新区盛鑫置业2楼,2015-12-16,CN105161694A,发明专利,"本发明属于材料合成及能源技术领域,具体涉及一种锂离子电池用硅-碳-石墨烯复合负极的制备方法。本发明的特征为,以微纳米尺度的硅基材料、覆碳前驱体、氧化石墨烯作为原料,在分散介质中与相应的分散剂相互作用均匀分散成电泳液,然后再通电进行电泳沉积,在电场作用下,微纳米尺度的硅基材料可以牢固结合在石墨烯的表面,而且在分散介质挥发之后纳米硅等微纳米尺度的硅基材料的表面会包覆上一层均匀的覆碳前驱体。最后将极片于惰性气氛中煅烧之后,氧化石墨烯被还原为石墨烯,覆碳前驱体的残碳则均匀包覆在纳米硅的表面,这样得到硅-碳-石墨烯复合负极。本发明的优点在于制备方法简单,将材料的合成与组装过程合二为一,可以简单的得到硅表...",中国专利,,CNKI
Patent,1,魏良明;柴双志;魏浩,一种石墨烯-硅纳米复合材料的制备方法,200240 上海市闵行区东川路800号,2015-12-16,CN105161696A,发明专利,"本发明提供一种石墨烯-硅纳米复合材料的制备方法,包括以下步骤：a.提供氧化石墨；b.在氧化石墨的层间嵌入长链表面活性剂使氧化石墨的层间的间距增大；c.将氧化石墨、烷基胺类化合物和硅酸酯类化合物混合、搅拌1-12h,之后收集沉淀物,干燥；d.干燥后的沉淀物在惰性气体保护下,于500-900℃下烘烤0.5-6h；e.通过镁热还原反应使烘烤后的沉淀物中的二氧化硅纳米结构转化为硅纳米粒子,得到石墨烯-硅纳米复合材料。本发明的石墨烯-硅纳米复合材料的制备方法不需要通过超声或热冲击把氧化石墨剥离成单层或者几层氧化石墨烯,避免了氧化剥离法中分散、剥离等繁琐的步骤及该些步骤对石墨烯结构的损害,可以大大减少对石...",中国专利,,CNKI
Patent,1,刘杨,一种表面石墨烯修饰的羟基磷灰石支架材料及其制备方法,213164 江苏省常州市武进区ﾜ韬ﾷ1号,2015-12-09,CN105126160A,发明专利,"本发明公开了一种表面石墨烯修饰的羟基磷灰石支架材料及其制备方法,包括以下步骤：(1)在常温下,分别配制一定浓度的Ca(NO3)2·4H2O及(NH4)2HPO4溶液；(2)将步骤(1)所得的Ca(NO3)2·4H2O及(NH4)2HPO4溶液按照一定的钙磷比进行共混,搅拌发生反应,反应过程中通过氨水调控反应液的稳定pH；(3)将(2)...",中国专利,,CNKI
Patent,1,魏大鹏;宋雪芬;孙泰;杨俊;申钧;史浩飞;杜春雷,稳定改善石墨烯光电性能的退火方法,400714 重庆市北碚区方正大道266号,2015-12-09,CN105140117A,发明专利,"本发明公开了一种稳定改善石墨烯光电性能的退火方法,包括如下步骤：将制备好的石墨烯样品置于加热装置内,在空气环境中200～300℃条件下退火5～120min,最后将石墨烯样品迅速降温至10～30℃即可获得光电性能优良的石墨烯。本发明采取直接在管式炉中升温退火,然后迅速降温的方法获得了光电性能改善明显的石墨烯,该石墨烯为多晶的石墨烯薄膜,其不仅导电性能优良,且具有良好的透光率。本发明所述方法处理成本低,应用范围广,可以直接在两端敞开的管式炉内,温度可控的真空干燥箱内或热板上实现。",中国专利,,CNKI
Patent,1,雷春生;潘相成,一种石墨烯手机散热片,213164 江苏省常州市罗溪镇空港产业园旺财路10号,2015-12-09,CN105141719A,发明专利,"本发明涉及一种石墨烯手机散热片,属于微电子封装领域,正硅酸乙酯和氧化石墨烯的比重为2-2.5,用无水乙醇和乙二醇溶液进行溶解,升温至回流,抽滤,转入马沸炉中,在450-480℃煅烧8小时,用常规电子束蒸发法,在二氧化硅表面上沉积一层二氧化硅和石墨烯的混合物,在表面涂上一层有机玻璃,放入高温炉中,在真空状态下以800℃的温度下隔火煅烧2小时,取出转移到目标芯片上,制得石墨烯手机散热片。",中国专利,,CNKI
Patent,1,朱桂林,基于石墨烯透明导电膜的不同温度下变色的LED灯带,215151 江苏省苏州市高新区浒关浒杨路88号,2015-12-09,CN105140220A,发明专利,"本发明公开了一种基于石墨烯透明导电膜的不同温度下变色的LED灯带,其由若干层压合而成,所述层依次为：柔性透明面板,其设于外层；柔性电致发光光源层,所述柔性电致发光光源层相邻于所述柔性透明面板一侧,所述柔性电致发光光源层包括至少两块石墨烯透明导电膜,所述石墨烯透明导电膜之间留有间隔,每一所述石墨烯透明导电膜上与所述柔性透明面板相邻的一侧等距地设有若干LED灯珠,所述LED灯珠设于所述柔性电致发光光源层上,每一所述石墨烯透明导电膜上的LED灯珠所发出的光颜色均不同；以及,柔性电致背光胶层,设于所述柔性电致发光光源层另一侧。",中国专利,,CNKI
