RT,SR,A1,T1,AD,FD,ID,CL,AB,DB,LA,DS
Patent,1,邱旦峰;王迎鹏;夏永君;卜刚,一种在石墨烯矩阵上原位生长氧化铜纳米颗粒的方法,210016 江苏省南京市秦淮区御道街29号,2015-11-25,CN105098150A,发明专利,"本发明公开了一种在石墨烯矩阵上原位生长氧化铜纳米颗粒的方法,该方法通过在石墨烯片层状结构上原位生长氧化铜纳米颗粒的方法,获得一种适用于锂离子电池的负极材料。与现有技术相比,本发明具有以下优点：本发明所述方法制得的氧化铜/石墨烯纳米复合材料能够为锂化/脱嵌锂过程中产生的体积变化作一个弹性缓冲,因此保证电极材料不破碎,从而增强电池负极的稳定性；此外,该材料能够增强锂离子电池的可逆容量以及维持电池良好的循环能力；并且能够最大程度的提高高度绝缘性电极材料的电化学性能；倍率性能高；操作简便,节约材料。",中国专利,,CNKI
Patent,1,何大伟;刘永川;王永生,一种石墨烯/硫复合材料的制备方法,100044 北京市海淀区西直门外上园村3号,2015-11-25,CN105098153A,发明专利,"一种在水溶液中制备石墨烯/硫复合材料的制备方法,涉及一种简便易行,并且石墨烯片层质量高,硫颗粒分散均匀的石墨烯/硫复合材料的制备方法。复合物中硫均匀分散于大比表面积和高导电性的石墨烯表面,一定程度限制了石墨烯片层的团聚,二组分的协同效应,使复合材料具有高的电化学性能。该方法,取氧化石墨烯置于容器中,加入每50mg氧化石墨烯则100mL的去离子水超声30分钟,再加入每50mg氧化石墨烯则0.8g的硫代硫酸钠溶液,搅拌,加热至95摄氏度,反应3-5小时,反应过程中慢慢滴加每50mg氧化石墨烯则10-20mL浓度为1mol/L硫酸溶液,将得到的混合液转移至离心机中离心,最终得到的沉淀物,再转移至真空...",中国专利,,CNKI
Patent,1,何建新;连艳平;王利丹;谭卫琳;韩ﾆ⒚￷;崔世忠;丁彬,一种掺杂石墨烯的中空多孔的碳/硅纳米纤维锂电池负极材料及其制备方法,451191 河南省郑州市新郑双湖经济技术开发区淮河路1号,2015-11-25,CN105098160A,发明专利,"本发明涉及一种掺杂石墨烯的中空多孔的碳/硅纳米纤维锂电池负极材料及其制备方法。它是由硅纳米粒子和石墨烯均匀地分散在碳纳米纤维基质中构成。具体制备方法为：以聚丙烯腈/聚甲基丙烯酸甲酯/正硅酸乙酯/氧化石墨烯的混合溶液作为壳层溶液,以聚甲基丙烯酸甲酯溶液作为芯层溶液,利用同轴静电纺丝技术得到掺杂氧化石墨烯的聚丙烯腈/聚甲基丙烯酸甲酯/二氧化硅纳米纤维,将得到的纳米纤维在200-300℃条件下预氧化,然后在500-1000℃条件下进行高温碳化,最后利用镁粉热还原得到掺杂石墨烯的中空多孔的碳/硅纳米纤维锂电池负极材料。本发明制备的掺杂石墨烯的中空多孔的碳/硅纳米纤维锂电池负极材料具有较大的比表面积和孔...",中国专利,,CNKI
Patent,1,段小明;刘博慧;贾德昌;杨治华;周玉,一种可用于锂离子电池负极的碳化钛纳米片/石墨烯复合材料的制备方法,150001 黑龙江省哈尔滨市南岗区西大直街92号,2015-11-25,CN105098162A,发明专利,"一种可用于锂离子电池负极的碳化钛纳米片/石墨烯复合材料的制备方法,它属于纳米陶瓷材料合成与制备领域。它要解决现有Ti3C2Tx/石墨烯复合材料的制备工艺复杂及效率低的问题。方法：一、制备Ti3AlC2粉末；二、制备堆垛的层片状Ti3C2Tx粉体；三、制备悬浮液；四、取制备片层状的Ti3C2Tx粉体；五、与氧化石墨烯复合,即完成。本发明的制备方法只需要制备T...",中国专利,,CNKI
Patent,1,李在均;张晨军;陈腾远;楚凯斌;班文宁;付婷;张余,一种高性能石墨烯钛酸锂复合电池材料的制备方法,214122 江苏省无锡市蠡湖大道1800号江南大学,2015-11-25,CN105098166A,发明专利,"本发明以钛酸四丁酯、P123、叔丁醇配成钛源分散液,以二水醋酸锂、去离子水和叔丁醇配成锂源溶液,将混合的钛源分散液转移至微波反应器中微波加热至回流,滴入锂源溶液,待滴入完毕后继续反应1h,冷却,去除溶剂,然后干燥得到钛酸锂前驱体。得到的钛酸锂前驱体放置管式炉中,在空气氛围下800℃煅烧8h,得到钛酸锂电极材料。得到的钛酸锂电极材料与石墨烯以一定比例在有机溶剂中超声分散均匀,去除溶剂,得到石墨烯/钛酸锂电极材料。将得到的活性材料、乙炔黑以及PVDF混匀均匀的在铝箔上面涂膜,制备得到纽扣电池电极片,最后在手套箱中组装半电池并对充放电性能进行测试将活性材料做成半电池进行性能检测,检测发现,石墨烯/钛...",中国专利,,CNKI
Patent,1,I·杜;金炫中,石墨烯/碳组合物,美国密歇根,2015-12-02,CN105122520A,发明专利,高表面积纳米尺寸石墨烯与碳的组合物。,中国专利,,CNKI
Patent,1,何大伟;杜翔;孟英;王永生,一种利用氧化石墨烯溶液制备石墨烯水凝胶电极的方法,100044 北京市海淀区西直门外上园村3号,2015-11-25,CN105097298A,发明专利,"一种利用氧化石墨烯溶液制备石墨烯水凝胶电极的方法,涉及水凝胶制备,解决了现有技术制备超级电容器石墨烯电极的复杂方法,提供一种反应条件温和,过程时间短,操作简单能耗较低,电极形状可控制的石墨烯电极制备方法。该方法是将氧化石墨烯粉末,按每1g加1～4L去离子水配制成氧化石墨烯分散液,以50～150rpm搅拌6～12h,以每1g氧化石墨烯粉末加入0.5～4g硫化钠或0.5～4g抗坏血酸作还原剂成为混合液；将制得的混合液,搅拌1～10min后,静置0.5～36h后,将混合液倒入电极形状对应的形状样品瓶中,封口,加热温度为80～95℃,加热时间为3～10h；取出样品瓶中的黑色固体用去离子水浸泡,浸泡的时...",中国专利,,CNKI
Patent,1,张慧波,一种石墨烯锂离子电池电解液,315800 浙江省宁波市北仑区新大路1069号,2015-11-25,CN105098239A,发明专利,"本发明涉及一种石墨烯锂离子电池电解液,包括锂盐与非水有机溶剂,所述石墨烯锂离子电解液还包括添加剂,所述添加剂由以下以电解液总重量为基准的成分组成：5-6.5%的六甲基二硅胺烷、0.5-3.5%的八甲基环四硅氧烷、4.5-8.5%的石墨烯及0.3-5.3%的维生素E。通过在锂离子电池电解液中添加石墨烯,能够大大提高电解液的耐电压性能,在高压下不易分解,而八甲基环四硅氧烷可以有效清除电解液体系中及游离到正极表面的腐蚀性物质,六甲基二硅胺烷的加入在充放电过程会吸附的铅电极表面,相当于提高氢的析出电位,可以减少氢的析出；锂离子电池在高温状态下储存,容量保持率与容量恢复率高,循环性能优良。",中国专利,,CNKI
Patent,1,刘春朝,一种石墨烯导电剂,315800 浙江省宁波市北仑区新大路1069号,2015-12-02,CN105118998A,发明专利,"本发明涉及一种石墨烯导电剂,所述石墨烯导电剂各组分的质量份数为：18-23份石墨烯、5-10份聚丙烯腈纤维、3-6份三乙烯四胺,#100-160份溶剂、1-5份稀土氧化物、0.5-1份碳化钛。本发明的有益效果是：采用石墨烯导电剂,利用石墨烯优良的导电性,提高电极材料的容量,降低电池内阻,提高电池循环寿命；石墨烯导电剂在制备锂离子电池时的用量仅为现有导电剂用量的50-60%,并减少了18%的粘结剂用量,但2C倍率却提高了6-10%,节省了成本,使得锂离子电池更具有竞争力。",中国专利,,CNKI
Patent,1,胡韬,在栅极表面生长石墨烯的方法及在源漏极表面生长石墨烯的方法,518132 广东省深圳市光明新区塘明大道9—2号,2015-11-25,CN105097478A,发明专利,"本发明提供一种在栅极表面生长石墨烯的方法及在源漏极表面生长石墨烯的方法,采用低温的等离子体增强气相沉积制程在含有铜的栅极或源漏极上生成膜厚可控且与所述栅极或源漏极的图案重叠的石墨烯薄膜,石墨烯的制备温度较低,可以最大限度地不破坏薄膜晶体管的结构,采用的碳源来源广泛,价格低廉,制作方法简单,可以使用薄膜晶体管制作产线中已有的PECVD设备,无需增加成本；包覆石墨烯后的栅极或源漏极,由于石墨烯的保护作用,避免了与水和氧的接触,解决了传统的TFT制程中含有金属铜的栅极或源漏极易被氧化的问题,另外高导电性的石墨烯也不会影响整个器件的电性表现。",中国专利,,CNKI
Patent,1,朱四新;姜彦南;袁锐;曹卫平;高超宁;其他发明人请求不公开姓名,基于石墨烯覆层的可重构天线,541004 广西壮族自治区桂林市金鸡路1号,2015-12-02,CN204834860U,实用新型,"本实用新型公开一种基于石墨烯覆层的可重构天线,包括天线本体,该天线本体包括接地板和直立于接地板上的单极子；所述天线本体还进一步包括一上下贯通、并呈中空柱状的电介质套筒,电介质套筒位于接地板的上方且置于单极子的外围；电介质套筒的内外侧表面中的一侧表面涂覆有石墨烯覆层,另一侧表面涂覆有硅覆层；上述石墨烯覆层和硅覆层各与外置偏置电压的一端相连,且与外置偏置电压的正极相连的石墨烯覆层或硅覆层与接地板之间存在一定的间隙。通过将石墨烯覆层和硅覆层分隔成多块,并控制其外置偏置电压,使得天线具有宽频带、频率可重构和/或辐射方向图可重构的特点。",中国专利,,CNKI
Patent,1,黄英;郭小辉;马阳洋;刘彩霞;刘平,一种紧凑型2.45GHz柔性可穿戴石墨烯天线,230009 安徽省合肥市包河区屯溪路193号,2015-12-02,CN105119046A,发明专利,"本发明公开了一种紧凑型2.45GHz柔性可穿戴石墨烯天线,其特征在于：是在一矩形柔性基体的下表面设置有矩形接地平面,上表面设置有辐射贴片；辐射贴片和接地平面均以石墨烯为材质。本发明紧凑型2.45GHz柔性可穿戴石墨烯天线具有结构紧凑、易于共形、便于穿戴等优点。",中国专利,,CNKI
Patent,1,钟起权;刘克;慈立杰;姜宗清,一种带有石墨烯导热硅脂散热层的CPU散热装置,518000 广东省深圳市宝安区福永街道新和社区新和同富裕工业区19号厂房1楼B,2015-12-02,CN105120631A,发明专利,"本发明涉及一种带有石墨烯导热硅脂散热层的CPU散热装置,包括风扇、散热器、CPU,其中,所述CPU及散热器之间设有石墨烯导热硅脂散热层；所述散热器的两侧安装有风扇。应用该装置,可实现CPU的快速散热。",中国专利,,CNKI
Patent,1,刘锋;王国平;刘胜;丁文,一种基于石墨烯/金属复合导线的片上电感及其制备方法,430072 湖北省武汉市武昌区珞珈山武汉大学,2015-12-02,CN105118821A,发明专利,"本发明公开了一种基于石墨烯/金属复合导线的片上电感及其制备方法,属于微电子器件技术领域。该片上电感包括衬底,衬底上设有由石墨烯/金属复合导线组成的电感线圈,所述石墨烯/金属复合导线包括金属导线及其外表面包裹的石墨烯膜。其制法为：(1)在衬底、转印有石墨烯的绝缘基片上或生长有二氧化硅的半导体基片上淀积金属膜,将金属膜刻蚀成金属电感线圈；(2)在金属电感线圈上覆盖石墨烯膜,即得基于石墨烯/金属复合导线的片上电感。其优点为：本发明提高了片上电感的品质因数、导热性、抗氧化能力、载流能力及高频工作性能,且单层石墨烯包覆在金属导线表面,对片上电感尺寸影响甚微,而且实现工艺简单,具有很强的实用性。",中国专利,,CNKI
Patent,1,罗伯特·弗里尔;科林·诺曼;悦·林;迪潘舒·斯里瓦斯塔瓦;伊恩·金洛克,包含石墨烯的热电材料和装置,英国曼彻斯特,2015-12-02,CN105122485A,发明专利,"描述了具有热电性质的复合材料和由这类材料制成的装置。热电复合材料可以包含金属氧化物材料和石墨烯或改性石墨烯。已经发现,向热电金属氧化物材料添加石墨烯或改性石墨烯增加ZT。还已经发现,金属氧化物的ZT变得在较宽的温度范围内且在较低的温度下有效。",中国专利,,CNKI
Patent,1,罗林保;王元;郑坤;卢瑞;于永强,一种铟纳米颗粒阵列修饰的石墨烯/硒化锌纳米带肖特基结蓝光光电开关及其制备方法,230009 安徽省合肥市包河区屯溪路193号,2015-12-02,CN105118887A,发明专利,"本发明公开了一种铟纳米颗粒阵列修饰的石墨烯/硒化锌纳米带肖特基结蓝光光电开关及其制备方法,其是在绝缘衬底上表面分布有硒化锌纳米带,硒化锌纳米带的一端设置有与硒化锌纳米带呈欧姆接触的金电极,另一端设置有与硒化锌纳米带呈肖特基接触的石墨烯薄膜,在石墨烯薄膜的上表面修饰有呈六角点阵排布的铟纳米颗粒阵列。本发明中的蓝光光电开关通过利用排列规则的铟纳米颗粒阵列表面等离子体共振的特性,增强了对光的吸收,提高了对光的响应度；本发明制备方法简单,适合大规模生产,可制备响应速度快、抗电磁干扰强的蓝光光电开关,为硒化锌纳米材料在光电开关的应用中开拓了新的前景。",中国专利,,CNKI
Patent,1,刘庆彬;李佳;何泽召;蔚翠;冯志红,一种蓝宝石盖板石墨烯投射式电容屏,050051 河北省石家庄市合作路113号,2015-12-02,CN204833225U,实用新型,"本实用新型公开了一种蓝宝石盖板石墨烯投射式电容屏,涉及电容屏技术领域。包括从上至下依次包括蓝宝石盖板层、石墨烯工作层、粘着剂层、玻璃基板层和ITO屏蔽层,石墨烯工作层由X轴石墨烯矩阵和Y轴石墨烯矩阵组成,形成石墨烯矩阵图案；X轴石墨烯矩阵和Y轴石墨烯矩阵相互交叉,X轴石墨烯矩阵内的各个石墨烯单元在X轴方向上两两之间相互连接,且X轴石墨烯矩阵两端分别与X轴金属引线连接,Y轴石墨烯矩阵内的各个石墨烯单元在Y轴方向上两两之间通过金属桥相互桥接,且Y轴石墨烯矩阵两端分别与Y轴金属引线连接。本实用新型将蓝宝石和石墨烯合理的结合,提高了触摸屏表面的耐磨性,石墨烯的应用简化了制作工艺,提高了透光率,降低了制...",中国专利,,CNKI
Patent,1,刘庆彬;李佳;何泽召;蔚翠;冯志红,一种蓝宝石基板石墨烯表面式电容屏,050051 河北省石家庄市合作路113号,2015-12-02,CN204833226U,实用新型,"本实用新型公开了一种蓝宝石基板石墨烯表面式电容屏,涉及电容式触摸屏的层状结构技术领域。包括从上至下依次包括盖板层、OCA光学胶层、石墨烯导电层和蓝宝石衬底,在所述蓝宝石衬底上外延生长单层或多层石墨烯导电层,所述石墨烯导电层四周设有金属铜电极,且与石墨烯贴合,所述金属铜电极连接有电极引线,所述金属铜电极通过电极引线能与控制芯片连接。本实用新型将蓝宝石和石墨烯合理的结合,提高了触摸屏表面的耐磨性,石墨烯的应用简化了制作工艺,提高了透光率,降低了制作成本。",中国专利,,CNKI
Patent,1,李平;敦洋洋;张华年;宋腾,基于石墨烯的被动调Q Nd:YAG人眼安全激光器,250199 山东省济南市历城区山大南路27号,2015-12-09,CN105140771A,发明专利,"基于石墨烯的被动调Q#Nd:YAG人眼安全激光器,属固态激光技术领域。包括泵浦源、谐振腔等,谐振腔内放置激光晶体、调Q器件,由温度控制系统对激光晶体和调Q器件保持恒温,其特征在于利用Nd:YAG晶体的特定增益谱线产生1444nm波长激光,用可饱和吸收体石墨烯对其进行被动调Q；激光晶体、输入镜M1、输出镜M2镀有能输出所需波长的介质膜。本发明是首次使用石墨烯作为被动调Q#Nd:YAG人眼安全激光器的可饱和吸收体。在泵浦功率为23.7W时,最大平均输出功率、最小脉宽、脉冲重复频率和单脉冲能量分别是411mW、560ns、85KHz和4.83μJ。本发明中产生的1444nm激光是人眼安全波长,在眼部...",中国专利,,CNKI
Patent,1,张晗;刘聪;韦晨;谢朝杰;李剑峰;刘永,一种基于石墨烯的中红外双波长同重频脉冲光纤激光器,611731 四川省成都市高新西区西源大道2006号,2015-12-16,CN105161968A,发明专利,"本发明公开了一种基于石墨烯的中红外双波长同重频脉冲光纤激光器,属于脉冲光纤激光器领域。本发明的一种基于石墨烯的中红外双波长同重频脉冲光纤激光器,包括覆有石墨烯薄膜层的反射镜,所述反射镜同一水平位上设有二色镜一,所述二色镜一相对于水平方向倾斜45°布置,所述二色镜一正上方设有相对平行的二色镜二,所述二色镜二上方为双波长脉冲输出端；所述二色镜一与反射镜之间设有平凸镜四,所述平凸镜四能将光束聚焦至反射镜；所述二色镜一处于3μm光谐振腔中,所述二色镜二处于2μm光谐振腔中,所述两二色镜均对2μm和3μm光同时具有方向导引作用。本发明设计巧妙,可获得中红外双波长同重频高功率激光脉冲,相较于传统方法来讲,...",中国专利,,CNKI
Patent,1,赵兵,一种氧化石墨烯-壳聚糖复合材料的制备方法,215001 江苏省苏州市高新区泰山路2号,2015-12-09,CN105131349A,发明专利,"本发明涉及一种氧化石墨烯-壳聚糖复合材料的制备方法,按照1:1的体积比,将0.01-10g/L的双醛壳聚糖溶液,与0.01-10g/L的氨基化氧化石墨烯溶液混合,在20℃-80℃的温度条件下匀速搅拌1-10h,用去离子水反复清洗、离心、烘干,得到氧化石墨烯-壳聚糖复合材料。该复合材料可用于水污染处理、生物医用等领域。",中国专利,,CNKI
Patent,1,吴锦荣;黄光速;李恒毅;郑静;谢正田;符玄,石墨烯/碳纳米管杂化填料网络增强橡胶材料及其制备方法,610065 四川省成都市武侯区一环路南一段24号,2015-12-09,CN105131359A,发明专利,"本发明公开了一种石墨烯/碳纳米管杂化填料网络增强橡胶材料及其制备方法,橡胶材料以石墨烯和碳纳米管为填料,在橡胶材料基体中形成杂化填料网络,橡胶材料基体100质量份,石墨烯和碳纳米管共0.1～20质量份。橡胶材料的制备,将氧化石墨烯和碳纳米管加入水中制取杂化悬浮液；将制备的杂化悬浮液加入到橡胶材料基体乳液中,混合后加入破乳剂破乳,制得氧化石墨烯/碳纳米管/橡胶颗粒悬浮液,之后加入还原剂进行还原反应,充分反应后进行固液分离,所得固相经洗涤、干燥即为要制取的橡胶材料。石墨烯和碳纳米管在橡胶材料中形成杂化填料网络,起能量耗散作用,使橡胶材料具有良好的力学性能、耐疲劳性能、抵抗裂纹生长性能和导电性能。",中国专利,,CNKI
Patent,1,仲崇明;汪卫帮,一种改性氧化石墨烯/PMMA复合材料的制备方法,215100 江苏省苏州市吴中区木渎镇珠江南路378号天隆大楼6727室苏州卓伟企业管理咨询有限公司,2015-12-16,CN105153614A,发明专利,"本申请公开了一种改性氧化石墨烯/PMMA复合材料的制备方法,以氨基封端的聚对苯二甲酰对苯二胺低聚物为改性剂,先对氧化石墨烯进行表面改性,再利用水合肼为还原剂对改性后的氧化石墨烯进行还原,得到改性的石墨烯,然后将制备的改性石墨烯溶解在NMP中进行完全剥离,然后将溶解改性石墨烯的NMP溶液分散在PMMA中,改性石墨烯的用量为0.1～0.2wt％。本发明通过的简单的一步聚合得到氨基封端的PPTA聚合物,并直接接枝到氧化石墨烯,得到改性后的石墨烯,改性后的石墨烯在有机溶剂中表现出了良好的分散性,同时PPTA上含有的极性基团以及苯环的结构,使之能与许多聚合物具有良好的相容性。由上述改性的氧化石墨烯制备的...",中国专利,,CNKI
Patent,1,杨程;张艳茹;戴圣龙;张晓艳;燕绍九,一种石墨烯聚合物复合纤维膜增强增韧复合材料的制备方法,100095 北京市海淀区温泉镇环山村,2015-12-16,CN105153640A,发明专利,"本发明提供了一种石墨烯聚合物复合纤维膜增强增韧复合材料的制备方法,属于高性能复合材料制备领域。通过石墨烯和热塑性聚合物经静电纺丝工艺制备的石墨烯聚合物复合纤维膜,将该石墨烯聚合物复合纤维膜铺覆于预浸料层间,再经真空热压成型工艺制成石墨烯增强增韧复合材料。采用本发明方法制备的复合材料力学性能显著改善,其冲击后压缩强度提高了30％以上,同时耐热性能有所改善。该方法的优点是石墨烯能均匀分散在复合材料中,且能增强复合材料中预浸料的层间作用力,石墨烯纤维膜的多孔结构有利于预浸料中的树脂在加热时的流动,提高复合材料内部结构的均匀性。",中国专利,,CNKI
Patent,1,杨程;郝思嘉;戴圣龙;张晓艳;燕绍九,一种污水处理用石墨烯宏观体材料的制备方法,100095 北京市海淀区温泉镇环山村,2015-12-09,CN105126750A,发明专利,"本发明涉及一种吸附材料领域的制备方法,具体为一种污水处理用石墨烯宏观体材料的制备方法,特别是该材料在污水处理方面的应用。该材料由石墨烯纳米片和石墨烯纤维膜组装而成的三维石墨烯宏观体结构,该方法包括：1)超声处理氧化石墨烯配成的水溶液；2)于反应釜中加入步骤1)得到的氧化石墨烯溶液和石墨烯纤维膜,加热至恒温后自然冷却,冷冻干燥处理,得石墨烯宏观体材料。本发明采用的原料来源广泛,制备成本低,且制得的宏观体材料孔隙结构发达,比表面积大,结构稳定,可广泛的用于污水处理中。",中国专利,,CNKI
Patent,1,郝思嘉;杨程;戴圣龙;张晓艳;燕绍九,一种烟气吸附用石墨烯多孔材料,100095 北京市海淀区温泉镇环山村,2015-12-09,CN105126751A,发明专利,"本发明涉及一种吸附材料,具体为一种烟气吸附用石墨烯多孔材料,特别是该材料在烟气吸附方面的应用。本发明提供的石墨烯多孔材料具有孔径范围大、孔径均一等特点,为其在烟气吸附领域的应用奠定了基础。而且该石墨烯多孔材料对苯酚、间苯二酚、柠檬醛、甲酸、乙酸、丁酸、正戊酸、异戊酸、棕榈酸、亚麻酸、吡啶或吡咯等烟气成分具有良好的吸附性能及其吸附的循环性能。",中国专利,,CNKI
Patent,1,杨程;和玉光;戴圣龙;张晓艳;燕绍九,一种石墨烯半导体屏蔽料,100095 北京市海淀区温泉镇环山村,2015-12-09,CN105131408A,发明专利,"本发明涉及一种高压电力电缆的屏蔽材料,具体为一种石墨烯半导体屏蔽料。本发明提供的石墨烯半导体屏蔽料由石墨烯纳米片及乙烯-醋酸乙烯酯制得,通过先配制分散均匀的石墨烯纳米片(GR)水溶液,搅拌下加入乙烯-醋酸乙烯酯(EVA)乳液,两者混合絮凝后,得到GR/EVA固体,用去离子水过滤冲洗至中性后真空冷冻干燥得GR/EVA母胶,通过双辊筒开炼机充分混合,加硫化剂处理后在平板硫化机上成型,获得石墨烯半导体屏蔽料。本发明的制备工艺简单、成本低、能耗低,易于控制；制得的石墨烯半导体屏蔽料具有低密度、半导电性能优越、耐压高、抗张强度高、超光滑且耐水树,产品可作为中高压电力电缆的理想屏蔽材料。",中国专利,,CNKI
Patent,1,杨程;和玉光;戴圣龙;张晓艳;燕绍九,一种石墨烯半导体屏蔽料的制备方法,100095 北京市海淀区温泉镇环山村,2015-12-09,CN105131409A,发明专利,"本发明涉及一种高压电力电缆的屏蔽材料的制备方法,具体为一种石墨烯半导体屏蔽料的制备方法。本发明通过先配制分散均匀的石墨烯纳米片(GR)水溶液,搅拌下加入乙烯-醋酸乙烯酯(EVA)乳液,两者混合絮凝后,得到GR/EVA固体,用去离子水过滤冲洗至中性后真空冷冻干燥得GR/EVA母胶,通过双辊筒开炼机充分混合,加硫化剂处理后在平板硫化机上成型,获得石墨烯半导体屏蔽料。本发明的制备工艺简单、成本低、能耗低,易于控制；制得的石墨烯半导体屏蔽料具有低密度、半导电性能优越、耐压高、抗张强度高、超光滑且耐水树,产品可作为中高压电力电缆的理想屏蔽材料。",中国专利,,CNKI
