RT,SR,A1,T1,AD,FD,ID,CL,AB,DB,LA,DS
Patent,1,朱爱萍;姜云龙;张翠翠;汪宏生,一种苯胺共聚物与石墨烯的复合材料、制备方法及其应用,225009 江苏省扬州市大学南路88号,2015-12-02,CN105111434A,发明专利,"一种苯胺共聚物与石墨烯的复合材料、制备方法及其应用,涉及金属表面的防腐技术领域,本发明以5-氨基水杨酸为苯胺的共聚单体,先以苯胺及5-氨基水杨酸还原氧化石墨烯,接着苯胺及其共聚单体在还原氧化石墨烯表面进行氧化聚合反应,制得的复合材料具有片层石墨烯表面负载苯胺共聚物纳米纤维的微观形貌,将所述复合材料添加于包含环氧改性丙烯酸酯树脂和氨基树脂烤漆料中,得到苯胺共聚物与石墨烯复合材料填充的水性纳米烤漆,表明本发明制备的复合材料能够使金属基底表面钝化,起到显著的电化学防腐作用。",中国专利,,CNKI
Patent,1,曾鸣;许清强;徐庆玉;李然然;殷蝶;曾碧君,功能化氧化石墨烯增强苯并ﾇf嗪基复合树脂及其制备方法,430074 湖北省武汉市洪山区鲁磨路388号,2015-12-02,CN105111437A,发明专利,"本发明涉及一种功能化氧化石墨烯增强苯并ﾇf嗪基复合树脂及其制备方法,它由以下方法制备得到：1)以天然鳞片石墨为原料,通过改进的Hummers方法制得氧化石墨；2)将氧化石墨进行化学改性,得到羧基化氧化石墨烯或氨基化氧化石墨烯；3)按质量％比,将0.1～10羧基化氧化石墨烯或氨基化氧化石墨烯与90～99.9苯并ﾇf嗪二元树脂预聚体或苯并ﾇf嗪三元树脂预聚体进行物理混合,得到混合样品；4)将混合样品在80～100℃下抽真空脱气1～2h,再于100～220℃固化反应4～24h,得到功能化氧化石墨烯增强苯并ﾇf嗪基复合树脂。本发明所制备的复合树脂固化无收缩,具有良好的耐热性、耐湿性、机械性能和电气性能。",中国专利,,CNKI
Patent,1,张慧波,一种石墨烯改性的PVC材料,315800 浙江省宁波市北仑区新大路1069号,2015-11-25,CN105086200A,发明专利,"本发明涉及一种石墨烯改性的PVC材料,包括基料,所述PVC材料加入了用于改性的石墨烯,在制备PVC材料的基料中加入石墨烯,所述石墨烯的加入量占PVC材料的重量百分比为12-23%,在PVC材料的基料中还加入改性添加剂,改性添加剂的加入量占PVC材料的重量百分比为1.5-5%。本发明在制备PVC材料的基料中加入石墨烯,工艺简单,适合工业化生产,由石墨烯改性的PVC材料在保证PVC材料原有性能基础上,大幅度提高了力学性能如提高了机械强度、韧性、耐磨擦性与耐冲击性。",中国专利,,CNKI
Patent,1,闫立群,一种石墨烯复合材料,214174 江苏省无锡市惠山经济开发区堰新路311号1号楼1001室,2015-11-25,CN204803256U,实用新型,"本实用新型涉及一种石墨烯复合材料。本实用新型包括复合材料本体,复合材料本体内分布有气孔,复合材料本体表面及气孔表面涂覆有传导层。传导层为厚度是5～20nm的氧化石墨烯。",中国专利,,CNKI
Patent,1,唐祝兴;李菲菲;王巧玲,一种氧化石墨烯-金属有机骨架纳米复合材料的制备方法,110159 辽宁省沈阳市浑南新区南屏中路6号,2015-12-02,CN105107462A,发明专利,"一种氧化石墨烯-金属有机骨架纳米复合材料的制备方法,是由盐酸多巴胺、氧化石墨烯和Tris缓冲溶液制成GO@PDA,再由GO@PDA、1,3,5-均苯甲酸、一水合醋酸铜、N,N-二甲基甲酰胺、乙醇、去离子水和三乙胺,制备成GO@PDA@MOF-199。本发明操作简单,成本低,所制备的GO@PDA@MOF-199纳米复合材料粒径处于纳米级别,颗粒均匀,分散性好,吸附能力强。制备的时候不会造成环境污染,对操作人员的健康无害。",中国专利,,CNKI
Patent,1,张慧波,一种石墨烯改性的耐磨橡胶,315800 浙江省宁波市北仑区新大路1069号,2015-12-02,CN105111531A,发明专利,"本发明涉及一种石墨烯改性的耐磨橡胶,包括合成橡胶、硫化促进剂、填充料、增塑剂,所述橡胶还包括石墨烯与助剂,各组分在橡胶中的重量百分比分别为合成橡胶48.9-56.5%、硫化促进剂1.5-2.5%、石墨烯8-18%、填充料25-30%、增塑剂1.5-5%与助剂0.1-3%。本发明在橡胶中加入石墨烯提高橡胶的强度,石墨烯润滑效果好,因此可提高橡胶的耐摩擦性；石棉纤维与聚酰亚胺纤维的加入可以使得橡胶的耐热性显著提高。",中国专利,,CNKI
Patent,1,刘洪刚;潘春呈;侯勇;赵剑英;倪雪庆,一种石墨烯改性聚醋酸乙烯酯类成膜剂制备方法,271000 山东省泰安市高新技术开发区,2015-11-25,CN105085835A,发明专利,"本发明提供了一种石墨烯改性聚醋酸乙烯酯类成膜剂制备方法,该方法是将石墨烯、氧化石墨烯或氨基化石墨烯经烯属不饱和单体改性反应后制得功能化石墨烯,再将其分散到醋酸乙烯酯、丙烯酸酯类或不饱和酸酐类单体的本体或水溶液中,经乳液聚合反应,制得石墨烯改性聚醋酸乙烯酯类乳液成膜剂,该方法反应温度低,工艺简单,成本低,导电效率高,所得成膜剂可以作为抗静电或导电成膜剂使用,用于制备玻璃纤维拉丝浸润剂、织物上浆剂、皮革涂饰剂、碳纤维上浆剂、粘合剂或涂料等,该成膜剂可以有效降低材料表面电阻,用于抗静电或电磁屏蔽材料领域。",中国专利,,CNKI
Patent,1,黎立桂;牛文翰;陈少伟,燃料电池用石墨烯-铁氮共掺杂多孔碳复合催化剂及其方法,510640 广东省广州市天河区五山路381号,2015-12-02,CN105107539A,发明专利,"本发明属于催化剂的技术领域,公开了一种燃料电池用石墨烯-铁氮共掺杂多孔碳复合催化剂及其方法。所述方法为(1)将2-氟苯胺、三价铁盐以及氧化石墨烯加入去离子水中,搅拌,超声分散,得到分散液；(2)将步骤(1)的分散液转移至水热反应釜中进行水热反应,冷却,过滤,清洗,干燥,得到聚2-氟苯胺-石墨烯片状物；(3)将步骤(2)中的聚2-氟苯胺-石墨烯片状物置于石英管式炉中,通入氮气,升温至700～900℃,保温反应,降温,得到铁氮共掺杂多孔碳催化剂。所述复合催化剂比表面积大、催化性能好、抗甲醇毒化能力强、耐久性好,稳定性高,可应用于燃料电池领域。",中国专利,,CNKI
Patent,1,代云茜;顾清;黄成谦;王世梅;丁木生;孙岳明,非金属催化剂为掺杂的还原氧化石墨烯及其制备方法和应用,210096 江苏省南京市四牌楼2号,2015-12-02,CN105107543A,发明专利,"非金属催化剂为掺杂的还原氧化石墨烯及其制备方法和应用,将氧化石墨烯及氨水均匀分散于水热釜中的水溶液里；将该混合液置于烘箱,调整温度为170~210℃,在该温度下反应5~8h；待冷却至室温后取出,移走上层液体,下层柱状固体即为非金属催化剂为掺杂的还原氧化石墨烯。通过光谱图和SEM对比分析,催化剂具有各向异性的特征,可知该催化剂确实具有高选择性,这种现象为我们提高该催化剂的催化活性提供了一种简单行之有效的方法,该方法在达到想要的催化效果后不但大大降低了成本,而且操作也简单易行,这也提高了人们对催化剂进一步认识,同时也推动了大家对催化剂相关方面的进一步研究。",中国专利,,CNKI
Patent,1,朴惠真;夏琦;C·施奈德;P·德斯保斯;B·布鲁赫曼;R·穆勒豪普特,含有石墨烯的聚酰胺复合物,德国路德维希港,2015-12-02,CN105121550A,发明专利,本发明涉及含有石墨烯的聚酰胺复合物、一种制备所述聚酰胺复合物的方法及其用作或用于制备具有阻气性能和/或导电性能和/或导热性能的材料和/或机械增强材料的用途。,中国专利,,CNKI
Patent,1,张慧波,一种石墨烯改性的碳纤维树脂材料,315800 浙江省宁波市北仑区新大路1069号,2015-11-25,CN105086361A,发明专利,"本发明涉及一种石墨烯改性的碳纤维树脂材料,碳纤维树脂材料中加入石墨烯,所述石墨烯的加入量占碳纤维树脂材料的重量百分比为55-75%,碳纤维树脂材料中还加入改性添加剂,改性添加剂的加入量占碳纤维树脂材料的重量百分比为5-10%。本发明添加了石墨烯的碳纤维与树脂成型体,其强度ﾩp导电性ﾩp导热性及耐磨性都有了显著提升。",中国专利,,CNKI
Patent,1,蒋永华;郝建东;栗建民;张维;魏艳丽,"磺化石墨烯-导电高分子分散液,其制备方法与应用",215000 江苏省苏州市工业园区星湖街218号生物纳米园A4楼112室,2015-11-25,CN105086377A,发明专利,"本发明公开了一种磺化石墨烯-导电高分子分散液,其包含磺化石墨烯和导电高分子,所述磺化石墨烯的径向尺寸为0.05μm～100μm,厚度为0.5nm～20nm,所述磺化石墨烯内磺酸基的含量以碳元素与硫元素的摩尔比表示为12:1～3:1,所述导电高分子可选自聚吡咯,聚噻吩,聚苯胺及该三者的衍生物。本发明还公开了一种制备所述磺化石墨烯-导电高分子分散液的方法。本发明的磺化石墨烯-导电高分子分散液具备稳定性高,成膜后机械性能优异和透光性好等优点,且其制备工艺简单,易于操作,可控性好,适于规模化生产。",中国专利,,CNKI
Patent,1,杨桂生;田文伟,一种石墨烯改性耐高温尼龙复合材料,201109 上海市闵行区北松路800号,2015-11-25,CN105085899A,发明专利,"本发明属于耐高温尼龙复合材料领域,涉及一种石墨烯改性耐高温尼龙复合材料及其制备方法。该材料由包括以下重量份的组分制成：尼龙盐100份、石墨烯0.05-2份、封端剂0.1-1份、抗氧剂0.02-0.5份、催化剂0.1-0.6份、成核剂0.05-0.3份、去离子水30-60份。本发明采用原位聚合的方法改善了石墨烯在尼龙基体内容易团聚的现象,提高了石墨烯与尼龙基体间的界面性能,提高了复合材料的耐磨性和冲击性能。本发明所制备的石墨烯改性耐高温尼龙复合材料具有比纯尼龙树脂更好的耐磨性和冲击性能,此方法简单易行,适合大规模工业化生产。",中国专利,,CNKI
Patent,1,杨程;郝思嘉;戴圣龙;张晓艳;燕绍九,一种空气净化用石墨烯海绵材料,100095 北京市海淀区温泉镇环山村,2015-12-02,CN105110311A,发明专利,"本发明涉及一种吸附材料,具体为一种空气净化用石墨烯海绵材料,特别是该材料在空气净化方面的应用。本发明提供的空气净化用石墨烯海绵材料,由质量份比为1∶5～20的石墨烯纳米片和碳纳米管组成三维网络结构。采用本发明提供的石墨烯海绵材料解决了传统吸附过程中的一些问题,本发明与现有技术相比,所制备的石墨烯基海绵比表面积大、吸附性能及循环性能优异。",中国专利,,CNKI
Patent,1,靳坤峰;张幸红;陈贵清;赵广东;洪长青;韩文波;胡平,石墨烯-碳纳米纤维复合气凝胶的制备方法,150001 黑龙江省哈尔滨市南岗区西大直街92号,2015-12-02,CN105110316A,发明专利,"石墨烯-碳纳米纤维复合气凝胶的制备方法,它涉及一种复合气凝胶的制备方法。本发明为了解决数层石墨烯间弱的化学键作用及石墨烯气凝胶内部为多孔结构导致力学性能差。本方法如下：一、制备氧化石墨烯-碳纳米纤维分散液；二、制备还原过的样品；三、将还原过的样品用去离子水冲洗后浸入氨水并保存,最后冷冻干燥或超临界干燥,得到石墨烯-碳纳米纤维复合气凝胶。本发明引入碳纳米纤维提高了强度；采用新的还原剂通过水热法使氧化石墨烯在温和条件下被还原。本发明属于气凝胶的制备领域。",中国专利,,CNKI
Patent,1,郭焕焕;慈立杰;丁显波;杨杰,一种石墨烯水性浆料及其制备方法,518000 广东省深圳市福田区上步中路1003号科学馆三楼,2015-12-02,CN105110318A,发明专利,"本发明适用于石墨烯材料领域,提供了一种石墨烯水性浆料及其制备方法,所述石墨烯水性浆料包括水性分散液及分散在所述水性分散液中的石墨烯材料,其中,所述水性分散液中含有表面活性剂。所述石墨烯水性浆料的制备方法包括以下步骤：以氧化石墨固体或可膨胀石墨固体为原料,进行膨胀处理,制备膨胀石墨；将所述膨胀石墨浸泡于水性剥离液中浸润处理,获得含膨胀石墨的混合物；将所述含膨胀石墨的混合物进行高速剪切或超声波处理,除去所述水性剥离液,得到石墨烯湿料；将所述石墨烯湿料置于水性分散液中,进行高速剪切处理,得到石墨烯水性浆料。",中国专利,,CNKI
Patent,1,郝思嘉;杨程;戴圣龙;张晓艳;燕绍九,一种空气净化用石墨烯海绵材料的制备方法,100095 北京市海淀区温泉镇环山村,2015-12-02,CN105110319A,发明专利,"本发明涉及一种吸附材料的制备方法,具体为一种空气净化用石墨烯海绵材料的制备方法,特别是该材料在空气净化方面的应用。该材料为石墨烯纳米片和碳纳米管组成三维网络结构。该方法包括：1)超声处理氧化石墨烯和碳纳米管配成的混合水溶液；2)将步骤1)得到的溶液转入反应釜中,加热恒温后自然冷却；冷冻干燥处理,得石墨烯海绵。采用本发明制备的石墨烯海绵材料解决了传统吸附过程中的一些问题,本发明与现有技术相比,所制备的石墨烯基海绵比表面积大、吸附性能及循环性能优异。",中国专利,,CNKI
Patent,1,杨程;郝思嘉;戴圣龙;张晓艳;燕绍九,一种烟气吸附用石墨烯多孔材料的制备方法,100095 北京市海淀区温泉镇环山村,2015-12-02,CN105110320A,发明专利,"本发明涉及一种吸附材料的制备方法,具体为一种烟气吸附用石墨烯多孔材料的制备方法。本发明提供的制备方法通过超声处理将氧化石墨烯配成水溶液；冷冻干燥处理液后进行热还原,最终得到石墨烯多孔材料。本发明提供的制备方法工艺简单,容易操作,且利用的原材料来源广泛,制备过程中无环境污染,工艺环保；制得的石墨烯多孔材料表面及内部结构均呈现三维、多孔状,且具有高的比表面积和孔隙率。",中国专利,,CNKI
Patent,1,王建国;王磊;钟兴;庄桂林,一种金属酞菁及其合金前驱体在石墨烯表面制备纳米孔的方法,310014 浙江省杭州市下城区潮王路18号浙江工业大学,2015-12-02,CN105110321A,发明专利,"本发明公开了一种金属酞菁及其合金前驱体在石墨烯表面制备纳米孔的方法。该石墨烯中纳米孔的孔径为3-50纳米。利用化学氧化超声分散的方法制备0.04-5mg/ml的氧化石墨烯分散液,并与0.1-5mg/ml金属酞菁或其合金的前驱体分散液混合均匀,再通过聚碳酸酯多孔膜真空抽滤和干燥除去溶剂,得到的黑色粉末在惰性气氛下以1-10℃/min的升温速率升温至400-1000℃,并在该温度段恒温1-10h得到所述纳米孔。该方法具有制备方法简单、制备周期短、设备便宜并且能大规模制备的特点,制备的纳米孔石墨烯能运用于DNA测序,气体分离净化和离子通道等领域。",中国专利,,CNKI
Patent,1,曾海波;吉建平;严仲;宋秀峰,一种三维石墨烯的制备方法,210094 江苏省南京市孝陵卫200号,2015-12-02,CN105110322A,发明专利,"本发明公开了一种三维石墨烯的制备方法,采用色氨酸为碳源,在惰性气体保护下,升温至指定温度并保温一定时间,从而制得自支撑的三维石墨烯。本发明以色氨酸为碳源,引入氮原子掺杂石墨烯,显著提高电学传输性能；本发明无需其他发泡剂辅助,自发泡效果更好,工艺简单。",中国专利,,CNKI
Patent,1,安琪;黄滔;张以河,一种氧化石墨烯自支撑超薄膜的制备方法,100083 北京市海淀区学院路29号,2015-12-02,CN105110323A,发明专利,"本发明公开了一种氧化石墨烯超薄膜的制备方法,利用层层自组装的方法,首先将在浓硫酸/双氧水混合溶液中洗干净的石英片在聚丙烯胺盐酸盐溶液中浸泡一段时间,然后用去离子水洗干净,氮气吹干,接着在氧化石墨烯分散液中浸泡相同时间,去离子水洗干净,氮气吹干,重复进行上述步骤,直到得到想要的层数,最外层为聚丙烯胺盐酸盐,然后在DAS浸泡,使其渗透到薄膜内部,通过紫外辐照引发层间和层内交联,增强薄膜的稳定性,接着把石英片放入氢氧化钠溶液中浸泡,破坏PAH与石英片基底之间的相互作用,使石英片上的薄膜发生脱落,然后把石英片放入水中,揭下石英片表面薄膜,即得到制备的氧化石墨烯自支撑超薄膜。",中国专利,,CNKI
Patent,1,狄增峰;戴家ￚS;王刚;郑晓虎;汪子文;薛忠营;张苗,一种制备无褶皱的石墨烯的方法,200050 上海市长宁区长宁路865号,2015-12-02,CN105110324A,发明专利,"本发明提供一种制备无褶皱的石墨烯的方法,包括以下步骤：S1：提供一催化基底,在所述催化基底表面预设区域进行离子注入以破坏注入区域的催化性能,并使得所述催化基底表面形成若干分立的未注入单元；S2：将所述催化基底放入生长腔室,将所述催化基底加热至预设温度,并往所述生长腔室内通入碳源,在所述催化基底表面生长出若干分立的没有褶皱的石墨烯单元。本发明不仅可以得到高质量的没有褶皱或褶皱密度很低的石墨烯单元还可以通过控制离子注入的区域,得到具有特定形状的石墨烯单元,从而适应多样的器件应用需求。",中国专利,,CNKI
Patent,1,何孝军;邵小龙,一种制备超级电容器用相互连接的且褶皱的石墨烯材料的方法,243002 安徽省马鞍山市花山区湖东路59号,2015-12-02,CN105110325A,发明专利,"本发明公开了一种制备超级电容器用相互连接的且褶皱的石墨烯材料的方法,属于炭材料制备技术领域。该方法是以被N,N-二甲基甲酰胺溶解的蒽油为碳源,纳米氧化镁为模板,氢氧化钾为活化剂,将所得原料研磨混合后所得的混合物转移至刚玉瓷舟中,在流动的氩气气氛下进行加热直接制得目标产物。本发明以廉价的蒽油为原料,具有工艺简单,成本低廉和适合工业化生产等优点。本发明所得相互连接且褶皱的石墨烯材料作为超级电容器的电极材料表现出了很高的容量和能量密度,在1-丁基-3-甲基咪唑六氟磷酸盐(BMIMPF6)离子液体电解液中,在50mA/g电流密度下,电极比容达271F/g,超级电容器的可用能量密度...",中国专利,,CNKI
Patent,1,朱振业,一种利用液相剥离法制备石墨烯的方法及石墨烯,518131 广东省深圳市龙华新区民治街道绿景香颂B2栋15层,2015-12-02,CN105110326A,发明专利,"本发明提供了一种利用液相剥离法制备石墨烯的方法,该方法包括：步骤一、制备一定浓度的十二烷基苯磺酸钠乙醇溶液；步骤二、将膨胀石墨过筛；步骤三、通过磁力搅拌将过筛后的膨胀石墨溶于步骤一制备的溶液中；步骤四、将步骤三中制备的膨胀石墨微波处理5min；步骤五、将微波处理后的溶液冰浴条件下超声剥离。步骤六、将经过超声处理后的溶液静止24h,经过离心、透析处理后获得石墨烯样品。经过形貌分析及结构分析表明,石墨烯片层较薄,层数在十层以内,结构缺陷小,导电性能好。",中国专利,,CNKI
Patent,1,罗德和;元栋观;朴银梭;柳在ﾆﾴ,石墨烯、用于制备石墨烯的组合物和利用该组合物制备石墨烯的方法,韩国庆尚南道昌原市,2015-12-02,CN105121337A,发明专利,公开了一种石墨烯、用于制备石墨烯的组合物和利用该组合物制备石墨烯的方法。,中国专利,,CNKI
Patent,1,权容ﾐﾜ;金基秀,石墨烯制造用组合物及利用该组合物的石墨烯制造方法,韩国庆尚南道昌原市,2015-12-02,CN105121338A,发明专利,"本发明公开一种石墨烯制造用组合物及利用该组合物的石墨烯制造方法。所提供的石墨烯包含：由化学式1或2表示的含氮有机化合物氧化剂；以及酸,其中,所述石墨烯的面电阻值低,且所述面电阻值的维持时间长。",中国专利,,CNKI
Patent,1,仲崇明;汪卫帮,一种改性氧化石墨烯/PI复合材料的制备方法,215100 江苏省苏州市吴中区木渎镇珠江南路378号天隆大楼6727室苏州卓伟企业管理咨询有限公司,2015-11-25,CN105086447A,发明专利,"本申请公开了一种改性氧化石墨烯/PI复合材料的制备方法,以氨基封端的聚对苯二甲酰对苯二胺低聚物为改性剂,先对氧化石墨烯进行表面改性,再利用水合肼为还原剂对改性后的氧化石墨烯进行还原,得到改性的石墨烯,然后将制备的改性石墨烯溶解在NMP中进行完全剥离,然后溶液共混法将溶解改性石墨烯的NMP溶液分散在PI中,改性石墨烯的用量为0.1～0.2wt％。本发明通过的简单的一步聚合得到氨基封端的PPTA聚合物,并直接接枝到氧化石墨烯,得到改性后的石墨烯,改性后的石墨烯在有机溶剂中表现出了良好的分散性,同时PPTA上含有的极性基团以及苯环的结构,使之能与许多聚合物具有良好的相容性。由上述改性的氧化石墨烯制备...",中国专利,,CNKI
Patent,1,徐志伟;倪亚;吴腾飞;陈磊;滕ﾈ耀h,一种提高三维石墨烯结构体/聚合物复合材料力学性能的方法,300387 天津市西青区宾水西道399号,2015-12-02,CN105111690A,发明专利,"一种提高三维石墨烯结构体/聚合物复合材料力学性能的方法,主要通过切割氧化石墨烯片的粒径,降低构建的三维石墨烯结构体的孔径,以此作为增强体,与聚合物树脂复合成型,提升三维石墨烯结构体/聚合物复合材料的力学性能。本发明涉及的三维石墨烯结构体孔径小,体密度大,使石墨烯在聚合物复合材料中的含量明显增加,有效提高了三维石墨烯结构体/聚合物复合材料的力学性能。同时,三维石墨烯结构体保持了石墨烯片在复合材料中稳定有序的分布状态,协同提高了三维石墨烯结构体/聚合物复合材料的力学性能。",中国专利,,CNKI
Patent,1,孙京华;潘正海,基于高分子材料/石墨烯的复合电极材料,214192 江苏省无锡市锡山经济开发区科技创业园(芙蓉中三路99号)瑞云六座,2015-12-02,CN105111702A,发明专利,"本发明公开一种复合电极材料以及其在改性电极方面的应用。本发明涉及的复合电极材料包括石墨烯、纳米铂、有机高分子材料等,在电极改性过程中利用有机高分子材料的高温降解,将纳米铂与石墨烯紧密结合并附着在电极上,提高了电极修饰物的均匀性,充分利用了石墨烯与纳米铂的高比面积,大大增加了载体电极的导电性,为电极的改性与修饰提供了一个新的方向。",中国专利,,CNKI
Patent,1,奚明;胡兵;吴红星;吴ﾈￒ;于广辉;张燕辉;陈志蓥;徐伟;张浩然,一种生长石墨烯薄膜的装置及其生长方法,201203 上海市浦东新区张江居里路1号,2015-11-25,CN105088335A,发明专利,"本发明提供一种在柔性衬底上生长石墨烯薄膜的装置,该装置包括：内腔,该内腔分为预处理仓、上反应仓和中反应仓,所述预处理仓、上反应仓和中反应仓分设有进气口和出气口且依次排列；金属衬底,一般为铜膜或铜镍合金膜,延伸于内腔,金属衬底两侧的细缝连通预处理仓、上反应仓和中反应仓；加热器,位于立式内腔外侧,用于加热金属衬底；反射板,位于加热器外周侧,用于将热量向立式内腔方向反射。进一步地,所述内腔和外腔均为立式结构,并且金属衬底垂直延伸于内腔中,并可由预处理仓向上反应仓、中反应仓的方向匀速移动。利用本发明的装置和方法能够量产出高品质、大尺寸的石墨烯薄膜。",中国专利,,CNKI
Patent,1,赵金花;秦希峰;王凤翔;付刚,一种调控SiC基外延石墨烯电子带隙的方法,251200 山东省济南市历城区临港开发区凤鸣路1000号,2015-11-25,CN105088350A,发明专利,"一种调控SiC基外延石墨烯电子带隙的方法,包括如下步骤：a)通过SRIM软件计算辐照离子在SiC晶体中产生的损伤分布、电子能量损失和核能量损失分布,计算缺陷石墨烯的能带结构；b)用离子束对SiC基外延石墨烯样品进行辐照,形成带有缺陷结构的外延石墨烯；c)分别采用金相显微镜观察石墨烯辐照前后的金相结构以及通过扫描电子显微镜观察石墨烯辐照前后表面褶皱变化；d)测通过公式##计算不同辐照条件下的石墨烯样品的...",中国专利,,CNKI
