RT,SR,A1,T1,AD,FD,ID,CL,AB,DB,LA,DS
Patent,1,李玲;陈思繁;宋浩,一种含有石墨烯的共混膜及其制备方法,518060 广东省深圳市南山区南海大道3688号,2016-01-06,CN105218987A,发明专利,"本发明适用于太阳能电池背膜的制备,提供了一种含有石墨烯的共混膜及其制备方法,所述共混膜为二氧化钛接枝物、PVDF、PMMA、PPA和石墨烯的共混膜,所述二氧化钛接枝物为表面接枝有硅烷偶联剂KH570的改性二氧化钛。本发明由于接枝物的存在克服了二氧化钛在共混膜中存在不均匀的现象,用于太阳能电池背膜时,薄膜与其他背板基材之间粘结力也大大增强,PMMA、PPA和石墨烯的存在也使提高了太阳能电池背膜的抗老化性、导热性和表面光滑性,其制备方法为：首先在二氧化钛表面接枝硅烷偶联剂KH570,再按质量比称量TiO2接枝物、PVDF、PMMA、PPA、石墨烯进行混合,搅拌均匀后,挤出成条...",中国专利,,CNKI
Patent,1,党渭铭;顾晨海,一种化学法石墨烯生产系统,214142 江苏省无锡市国家高新技术产业开发区华友东路6号,2016-01-13,CN204958408U,实用新型,"本实用新型公开了一种化学法石墨烯生产系统,具有反应釜,所述反应釜顶部具有数个加料口,其特征在于,所述反应釜的下方设置有管式反应器,所述管式反应器的一端通过循环泵与反应釜下端连通,另一端与反应釜上端连通,所述管式反应器外侧设置有冷却夹套,反应釜内介质通过循环泵流入管式反应器内经冷却后又重新从顶部流入反应釜内。本实用新型具有的有益效果：反应釜内的介质通过循环泵经管式反应器冷却后返回反应釜,实现外循环冷却,弥补了釜因放大而传热强度降低的弊端；并且由于泵的输送,形成管道反应器内强烈湍动,强化了混合和传质过程,加速了化学反应。",中国专利,,CNKI
Patent,1,蒋永华;栗建民;郝建东;张维,磺化石墨烯金属盐固态聚合物电解质及其制备方法和应用,215000 江苏省苏州市工业园区星湖街218号生物纳米园A4楼112室,2016-01-06,CN105218992A,发明专利,"本发明公开了一种磺化石墨烯金属盐固态聚合物电解质及其制备方法和应用。该磺化石墨烯金属盐固态聚合物电解质包括磺化石墨烯金属盐和固态聚合物电解质,该磺化石墨烯金属盐由磺化石墨烯中的部分磺酸与金属化合物反应制得；该固态聚合物电解质选自多羟基类聚合物；磺化石墨烯金属盐与固态聚合物电解质之间由磺化石墨烯中的部分磺酸与固态聚合物电解质中部分羟基反应制得。本发明的磺化石墨烯金属盐固态聚合物电解质具有较高离子电导率,较宽的电化学窗口,与电极材料的化学和电化学相容性好,在锂离子电池、超级电容器等电化学/物理储能设备中具有广泛应用前景,且制备工艺简单,易于实施和调控,反应条件温和,原料来源广泛,便于规模化生产。",中国专利,,CNKI
Patent,1,黄杰;沈政,一种改性石墨烯-聚乙烯醇复合薄膜的制备方法,400054 重庆市巴南区李家沱红光大道69号,2016-01-06,CN105218996A,发明专利,"本发明公开了一种改性石墨烯-聚乙烯醇复合薄膜的制备方法,本发明的改性剂选用7-羟基-4-甲基香豆素,本发明选用水合肼、维生素C或葡萄糖等化学还原剂；先制备改性石墨烯,再配制改性石墨烯的分散液,然后将改性石墨烯的分散液加入到聚乙烯醇水溶液中,得到分散均匀的改性石墨烯-聚乙烯醇混合溶液；最后将上述混合溶液倒入器皿中,在大气或者真空环境下,于40-70摄氏度干燥至恒重,得到改性石墨烯/聚乙烯醇复合薄膜。其中,改性石墨烯的质量分数为0.1%-10%。本发明具有制备简单、反应条件温和、易于操控制等优点。",中国专利,,CNKI
Patent,1,张弛;王爱健;虞王;宋京宝;钱军;龙凌亮,卟啉-还原氧化石墨烯非线性光学材料及其制备方法,212013 江苏省镇江市京口区学府路301号,2016-01-06,CN105218556A,发明专利,"本发明属于军工强激光防护材料领域,涉及卟啉-还原氧化石墨烯非线性光学材料及其制备方法,具体为自由基亲电加成制备的卟啉共价功能化的还原氧化石墨烯纳米杂化非线性吸收光学功能材料。本发明主要是针对目前激光防护材料存在的问题和石墨烯类材料溶解性较差的局限,开发具有良好溶解性的新型卟啉共价功能化的还原氧化石墨烯类非线性吸收光学功能材料,通过采用自由基亲电加成将卟啉共价修饰在还原氧化石墨烯表面,制备的有机-无机纳米杂化光敏功能材料集卟啉与还原氧化石墨烯两者的特性于一体,同时利用组分间的协同效应使杂化材料具有比其单一材料更优良的非线性光学性能,并且改善了石墨烯的溶解性和分散稳定性,具有良好的应用前景。",中国专利,,CNKI
Patent,1,吴斌;王世强;单升升;景录如;黄芬;夏媛娇;井丰喜,一种苯并ﾇf嗪/环氧树脂/氧化石墨烯复合材料及其制备方法,215214 江苏省苏州市吴江区汾湖经济开发区北厍育才路36号,2016-01-06,CN105219025A,发明专利,"本发明提供一种苯并ﾇf嗪/环氧树脂/氧化石墨烯复合材料及其制备方法,该三元复合材料降低了固化温度,增加了韧性。包括如下步骤：步骤1、将氧化石墨烯溶于溶剂中制得氧化石墨烯溶液；步骤2、在步骤1制得的氧化石墨烯溶液中加入环氧树脂,搅拌使之分散均匀,制得环氧树脂和氧化石墨烯混合液；步骤3、在步骤2制得的环氧树脂和氧化石墨烯混合液中加入苯并ﾇf嗪中间体,搅拌使之分散均匀,制得苯并ﾇf嗪/...",中国专利,,CNKI
Patent,1,元栋观;尹锺赫,石墨烯合成装置及利用该装置的石墨烯合成方法,韩国庆尚南道昌原市,2016-01-13,CN105246588A,发明专利,"本发明公开一种石墨烯合成装置,包括：腔室,定义用于安置多个基板的内部空间,其中,所述多个基板被布置为其各个面相互面对；气体供应部,将含碳气体供应到所述内部空间；主加热部,向所述内部空间照射辐射热；第一辅助加热部,对应于所述主加热部而被布置为面向所述基板的一个表面,且将所述辐射热转化为对流热并将转化的对流热释放到所述内部空间；多个第二辅助加热部,被布置为在所述多个基板之间的各个间隔中且面向所述基板的至少一个表面,并在吸收所述辐射热和所述对流热而被加热之后将热量释放到所述内部空间。",中国专利,,CNKI
Patent,1,曾鸣;许清强;徐庆玉;李然然;冯子健,原位插层溶液法制备的功能化氧化石墨烯增强苯并ﾇf嗪基复合树脂,430074 湖北省武汉市洪山区鲁磨路388号,2016-01-06,CN105219078A,发明专利,"本发明涉及原位插层溶液法制备的功能化氧化石墨烯增强苯并ﾇf嗪基复合树脂及其制备方法,其制备方法如下：1)以天然鳞片石墨为原料,通过改进的Hummers方法制得氧化石墨；2)将氧化石墨进行化学改性,得到羧基化氧化石墨烯或氨基化氧化石墨烯；3)将功能化氧化石墨烯分散于有机溶剂中,得到功能化氧化石墨烯分散液,将功能化氧化石墨烯分散液与树脂预聚体溶液进行共混得到混合液；4)将混合液于80～100℃抽真空脱气1～2h,再于100～220℃固化反应4～24h,得到功能化氧化石墨烯增强苯并ﾇf嗪基复合树脂。本发明制备的复合树脂固化无收缩,具有良好的耐热性、耐湿性、机械性能和电气性能。",中国专利,,CNKI
Patent,1,徐志伟;朱婷;倪亚;陈磊;石睫,一种制备三维石墨烯/碳纳米管超轻结构体的方法,300387 天津市西青区宾水西道399号,2016-01-13,CN105236384A,发明专利,"一种制备三维石墨烯/碳纳米管超轻结构体的方法。本发明将浸渍法和等离子体增强化学气相沉积(PECVD)技术相结合,实现碳纳米管在三维石墨烯泡沫上的原位生长,从而获得三维石墨烯/碳纳米管超轻结构体。此外,通过调节浸渍液和PECVD技术参数,可调控碳纳米管在三维石墨烯泡沫上的生长行为。本发明涉及的三维石墨烯/碳纳米管超轻结构体制备技术既确保了三维骨架结构的完整性,又具有工艺简单,周期短,产率高,成本低,绿色环保等优点,可实现工业化批量生产。",中国专利,,CNKI
Patent,1,刘富池;孙媛媛;汤怒江;钟伟;都有为,大规模制备石墨烯量子点的方法与装置,210093 江苏省南京市鼓楼区汉口路22号,2016-01-13,CN105236389A,发明专利,"一种大规模制备石墨烯量子点的方法,以导电炭黑为原材料,以浓硝酸为氧化剂,将导电炭黑和浓硝酸放在烧瓶中,同时放入磁力搅拌子；烧瓶设有回流装置,回流装置的管道中的一段为冷凝管；将烧瓶置于油浴锅中,把油浴锅升温至135±2℃,在磁力搅拌子搅拌下,在135℃下回流反应24±6小时；然后关闭低温恒温浴装置,把油浴锅升温至180±2℃,向烧瓶底通入氩气,在180±2℃下蒸发浓硝酸10±2小时；把所得的固体样品溶于去离子水中,然后使用高速离心机离心；取离心后所得的上层悬浮液分别用220nm和25nm的滤膜进行过滤,去除未氧化的炭黑或者大的颗粒；收集抽滤后所得的石墨烯量子点溶液,用旋转蒸发仪在40-80℃对其...",中国专利,,CNKI
Patent,1,王小英;叶伟杰;孙润仓,木质素溶液制备石墨烯的方法,510640 广东省广州市天河区五山路381号,2016-01-13,CN105236391A,发明专利,"本发明公开了一种木质素溶液制备石墨烯的方法。以造纸黑液中提取的木质素作为还原剂和稳定剂,将木质素溶解在碱性溶液中,在加热条件下与氧化石墨烯水溶液发生氧化还原反应,通过控制反应温度、时间和木质素的浓度,得到稳定分散的石墨烯。该过程操作简单,是一种绿色、环保、快速的石墨烯制备方法,完全符合“绿色化学”的要求。木质素是储量丰富的天然生物质资源,但是大部分作为废物排放。因此,本发明不仅为石墨烯的绿色合成提供了一条新思路,更对资源高值化利用的发展产生重大意义。",中国专利,,CNKI
Patent,1,张鉴炜;石刚;蒋彩;鞠苏;江大志,碳纳米管/石墨烯复合薄膜及其制备方法,410073 湖南省长沙市德雅路109号中国人民解放军国防科学技术大学航天科学与工程学院,2016-01-13,CN105236392A,发明专利,"本发明公开了一种碳纳米管/石墨烯复合薄膜及其制备方法。该碳纳米管/石墨烯复合薄膜是由石墨烯片层堆积而成,石墨烯片层之间生长有碳纳米管,连接上下层或左右相邻的石墨烯片层。制备方法包括制备含石墨烯类物质的溶液A；制备含高分子碳源和过渡金属催化剂前驱体的溶液B；将溶液A和溶液B混合,得混合溶液；将混合溶液过滤,烘干,得掺杂石墨烯类物质薄膜；将掺杂石墨烯类物质薄膜在还原气体和惰性气体中加热升温,得到碳纳米管/石墨烯复合薄膜。本发明的碳纳米管/石墨烯复合薄膜的面内方向和厚度方向都具有高导热性能,可应用于散热系统中,解决高热流密度领域的散热问题。",中国专利,,CNKI
Patent,1,何孝军;邵小龙,一种制备超级电容器用相互连接的石墨烯纳米片的方法,243002 安徽省马鞍山市花山区湖东路59号,2016-01-13,CN105236394A,发明专利,"本发明公开了一种制备超级电容器用相互连接的石墨烯纳米片的方法,属于炭材料制备技术领域。该方法是以溶于N,N-二甲基甲酰胺的煤焦油为碳源,纳米氧化镁为模板,氢氧化钾为活化剂,三者研磨混合后将混合物转移至刚玉瓷舟中,置于管式炉内在常压条件下进行加热,直接制得产物。本发明以廉价的、富含芳香性碳氢单元的煤焦油为原料直接制备石墨烯纳米片,具有工艺简单、成本低、适合工业化生产等优点。本发明制备的石墨烯纳米片电极材料在6mol/L#KOH电解液中,当电流密度从0.05A/g增加到20A/g时,电极材料的容量保持率达83.3％,在20A/g电流密度下,电极材料的比容为261F/g,显示了很高的容量和很好的速率...",中国专利,,CNKI
Patent,1,李耀刚;李佳慧;侯成义;王宏志;张青红,一种氧化石墨烯薄膜的制备方法,201620 上海市松江区松江新城人民北路2999号,2016-01-13,CN105236396A,发明专利,"本发明涉及一种氧化石墨烯薄膜的制备方法,包括：用毛笔蘸取氧化石墨水溶液,然后刷涂在基底上,加热干燥,即得。本发明的操作方法简单,制备过程方便快速；本发明所制备的氧化石墨烯薄膜宏观尺寸、形状等参数,及还原程度均可控,且可有效降低石墨烯片层间的堆叠,导电性增强。",中国专利,,CNKI
Patent,1,王美玲;孟国文,碳量子点-石墨烯纳米片复合体的制备方法,230031 安徽省合肥市蜀山湖路350号2号楼1110信箱,2016-01-13,CN105236397A,发明专利,"本发明公开了一种碳量子点-石墨烯纳米片复合体的制备方法。它先将花生壳分别置于乙醇和去离子水中超声清洗后干燥,再按照花生壳、1,6-己二胺和氢氧化钠溶液的重量比为1～1.4：1.8～2.2：40的比例将三者混合后置于180～220℃下密闭反应,得到反应液,之后,先对反应液依次进行过滤、离心分离和透析的处理,得到复合体溶液,再干燥复合体溶液,制得石墨烯纳米片上负载有碳量子点的碳量子点-石墨烯纳米片复合体。它的原材料来源广泛、价廉,制作过程便捷、环保、产量高、成本低,其产物极易于商业化地应用于环境、医学、食品等领域中Cr3+的荧光检测。",中国专利,,CNKI
Patent,1,冯国通;邱宁;王秀振,一种微波辅助制备石墨烯的生产方法,266109 山东省青岛市高新技术产业开发区华东路826-8号,2016-01-13,CN105236398A,发明专利,"本发明提供了一种微波辅助制备石墨烯的生产方法,步骤为：将石墨放入微波膨胀装置中进行快速膨胀,得到蠕虫状石墨；将蠕虫状石墨进行氧化反应,经洗涤、干燥后得到干燥的氧化石墨；将干燥的氧化石墨送入微波还原装置中,在真空或惰性气体保护条件下同时进行剥离与还原,得到干燥的石墨烯粉末。本发明的优势在于膨胀之后的蠕虫状石墨更有利于氧化过程的进行,其次,剥离与还原在一个步骤内完成,大大节约时间同时避免了强毒性还原剂的使用,本发明克服了传统石墨烯制备工艺中制备周期长的缺点,并简化了操作过程,减少了部分化学试剂的使用,是一种速度快,产率高,污染低,适合工业化的生产工艺。",中国专利,,CNKI
Patent,1,隋坤艳;谭业强;刘成;张庆旭;张文谦;张明;夏延致,一种氧化石墨烯/海藻酸钠液晶复合溶液的制备方法及应用,266071 山东省青岛市市南区宁夏路308号,2016-01-13,CN105237816A,发明专利,"本发明公开了一种氧化石墨烯/海藻酸钠液晶复合溶液的制备方法,包括以下步骤：先将氧化石墨烯加入去离子水中,制得氧化石墨烯溶液,氧化石墨烯溶液的浓度为1-10mg/mL；然后向氧化石墨烯溶液中加入海藻酸钠,制得氧化石墨烯/海藻酸钠液晶复合溶液；氧化石墨烯/海藻酸钠液晶复合溶液中氧化石墨烯与海藻酸钠的质量比为0.5-0.05。本发明通过在氧化石墨烯(GO)溶液中添加海藻酸钠(SA)促进其液晶相的形成,所制得的氧化石墨烯/海藻酸钠液晶复合溶液具有较低的液晶临界浓度,而且工艺简单,易操作,成本低廉,对环境友好,产品易于获得。本发明有望实现在更低的氧化石墨烯(GO)的浓度下制备高度取向的纤维和薄膜材料等,...",中国专利,,CNKI
Patent,1,施利毅;颜蔚;王令;李爱军;陈昶,氮掺杂石墨烯空心球的制备方法,200444 上海市宝山区上大路99号,2016-01-13,CN105236399A,发明专利,"本发明涉及氮掺杂石墨烯空心球的制备方法。以聚苯乙烯微球为模板,石墨烯为碳源,三聚氰胺为氮源,经煅烧,得到了NGHM。制备得到的NGHM对ORR有很好的催化性能。与商用的Pt/C催化剂相比,虽然ORR在NGHM的起始电势比在Pt/C上略低,但ORR在NGHM上的限制电流密度与在Pt/C上相当。另外与Pt/C相比,NGHM具有较高的稳定性及耐毒性,且成本低。因此制备的NGHM完全有可能替代商用Pt/C。",中国专利,,CNKI
Patent,1,王丽华;张子珍;赵建国,一种石墨烯制备过程中的除杂方法,037009 山西省大同市兴云街1号山西大同大学物理与电子科学学院,2016-01-13,CN105236400A,发明专利,"本发明公开了一种石墨烯制备过程中的除杂方法,包括如下步骤：A、在石墨原料中加入浓硝酸,将石墨氧化成氧化石墨；然后加入过量的碳酸钠进行中和；B、在步骤A中得到的氧化石墨中加入吸附剂,然后使用盐酸、乙醇和水的混合液进行冲洗过滤,然后进行烘干；C、将步骤B中得到的氧化石墨投入处理液中,过滤收集沉淀物,使用纯水冲洗、然后进行烘干；D、将经过步骤C处理过的氧化石墨进行过滤,然后放入反应釜中；向反应釜中通入臭氧；然后将反应釜泄压,向反应釜中通入流动的一氧化碳,直至氧化石墨干燥。本发明能够解决现有技术的不足,提高了石墨烯制备过程中非金属杂质的分离除杂效果。",中国专利,,CNKI
Patent,1,郑金木;乔素珍;张柏华,改性石墨烯／胶乳复合材料制备高强度、高隔绝性避孕套的方法,117000 辽宁省本溪市经济开发区神农大街18-13,2016-01-13,CN105237828A,发明专利,"本发明涉及复合材料及医疗器械领域,具体为一种利用改性石墨烯/胶乳复合材料制备具有高强度、高隔绝性避孕套的方法。将改性石墨烯制备成稳定的分散液,然后在胶乳配合及预硫化熟成阶段后直接复合,或者在该阶段中同时完成硫化复合,最终制成复合胶乳液。复合胶乳经熟化后,采用模具浸渍方法制备出避孕套产品。与现有产品相比,本发明制备出的石墨烯复合的避孕套,具备可有效阻隔小尺寸病毒的透过,在相同厚度下的抗撕裂性,爆破体积和极限伸长率等性能指标均明显提高。本发明具有原理科学,特点显著,无毒无害,性能稳定,与现行的避孕套生产的工艺匹配度高等优点。",中国专利,,CNKI
Patent,1,郑金木;乔素珍;张柏华,含改性石墨烯／胶乳夹层的高强度、高隔绝性避孕套的制备方法,117000 辽宁省本溪市经济开发区神农大街18-13,2016-01-13,CN105237829A,发明专利,"本发明涉及复合材料及医疗器械领域,具体为一种含改性石墨烯/胶乳夹层的高强度、高隔绝性避孕套的制备方法。将改性石墨烯制备出稳定的分散液与胶乳液以及常用助剂混合均匀,制成复合胶乳液；采用三次浸渍工艺成型,第一次和第三次浸渍时为常规胶乳液浸渍；第二次浸渍时,浸渍液为改性石墨烯/胶乳的复合胶乳液,最终制成最内表面和最外表面为常规胶乳膜,中间为含改性石墨烯/胶乳复合材料膜为夹层的三明治结构的避孕套。本发明制备复合石墨烯的避孕套,具有阻隔小尺寸病毒穿透特性。在相同尺寸下的抗撕裂性,爆破体积和极限伸长率等指标均明显提高。本发明具有原理科学,特点显著,无毒无害,性能稳定,与现行的避孕套生产工艺好匹配等优点。",中国专利,,CNKI
Patent,1,陶国良;夏艳平,一种镀银石墨烯的制备方法及其在导电阻燃高密度聚乙烯抑爆材料中的应用,213164 江苏省常州市武进区ﾜ韬ﾷ1号,2016-01-13,CN105237847A,发明专利,"本发明属于阻隔抑爆材料技术领域,特别涉及一种导电阻燃高密度聚乙烯/镀银石墨烯复合抑爆材料的制备工艺。通过“石墨烯的纯化处理；石墨烯的酸化、硅烷化处理；石墨烯悬浮液的制备；银氨溶液的配制；石墨烯的化学镀银”这些步骤,得到表面化学镀银的石墨烯。再将镀银石墨烯与高分子材料共挤出,得到导电阻燃高分子/镀银石墨烯复合抑爆材料。具有优良的导电性,化学性,阻燃性和抑爆性能,可以克服现有抑爆材料中的缺陷。",中国专利,,CNKI
Patent,1,吉诺·高弗雷迪;奥尔多·隆戈;奥尔加·瓦伦蒂诺;里卡尔多·菲利萨里;亚历山德罗·卡萨里尼,用于合成包含石墨烯的纳米结构聚合物的阳离子聚合方法,意大利圣多纳托-米拉内塞,2016-01-13,CN105246927A,发明专利,"一种用于合成包含石墨烯的纳米结构聚合物的阳离子聚合方法,包括在适合于活化阳离子聚合的至少一种无机强酸的存在下,使借助于超声波分散在溶剂中的氧化石墨与至少一种乙烯基单体和至少一种乙烯基芳香族单体反应,其中：-所述氧化石墨包含按重量计从5％至60％的结合氧,-所述乙烯基单体包含至少一个羧基,其中结合至氧化物的氧和羧基之间的比率以摩尔/摩尔计为在从1:10至10:1的范围中,并且-所述乙烯基芳香族单体与氧化石墨和包含羧基的乙烯基单体的量的总和之间的比率按重量计为在从50％至99％的范围中。",中国专利,,CNKI
Patent,1,邱凤仙;陈彩红;笪祖林;杨冬亚;曹天林,氨基功能化的氧化石墨烯/偶氮聚合物复合波导材料的制备及应用,212013 江苏省镇江市京口区学府路301号,2016-01-06,CN105218779A,发明专利,"本发明属于高分子纳米复合材料合成领域,涉及一种氨基功能化的氧化石墨烯/偶氮聚合物复合波导材料的制备及应用。本发明先由对硝基苯胺和间苯二胺制备得到偶氮生色分子4-(4-硝基-烯基)苯基-1,3-二胺,接着NAPD与IPDI在T-12催化下制得异氰酸根封端的偶氮苯预聚体；然后将氧化石墨超声剥离制得氧化石墨烯分散液,在2-(7-偶氮苯并三氮唑)-N,N,N',N'-四甲基脲六氟磷酸酯的作用下与乙二胺反应制得氨基功能化的氧化石墨烯；将异氰酸根封端的偶氮苯预聚体加入EAGO中,经真空干燥成。所制得的氨基功能化的氧化石墨烯/偶氮聚合物复合波导材料,热光系数(dn/dT)比普通有...",中国专利,,CNKI
Patent,1,袁兴中;吴志斌;钟华;王侯;陈晓红;冷立健;肖智华;蒋龙波;黎一夫;曾光明,还原氧化石墨烯的制备方法、还原氧化石墨烯及其应用,410082 湖南省长沙市河西岳麓山湖南大学环境科学与工程学院,2016-01-06,CN105214607A,发明专利,"本发明公开了一种还原氧化石墨烯的制备方法、还原氧化石墨烯及其应用,其制备方法包括：将氧化石墨烯与水混合,超声剥离,得到氧化石墨烯混合液；将所述氧化石墨烯混合液与乙二胺二琥珀酸混合,于微波辐射下进行还原反应,得到还原氧化石墨烯。本发明的制备方法简单易行、反应条件温和、生产成本低、绿色环保无污染、EDDS可重复利用等优点,其制备得到的还原氧化石墨烯表面含氧官能团低,共轭程度高,分散性好,比表面积大,层间距大等特点,能广泛应用于处理含抗生素废水,具有处理过程操作方便,吸附量大,吸附时间短,无二次污染等优点,可应用于废水中抗生素的无害处理,对开发石墨烯基的材料以及应用于环境领域具有十分重要的意义。",中国专利,,CNKI
Patent,1,马杰;庄媛;陈君红,一步法制备多孔海藻酸盐-石墨烯纳米复合凝胶球的方法,200092 上海市杨浦区四平路1239号,2016-01-06,CN105214611A,发明专利,"本发明公开了一种一步法制备多孔海藻酸盐-石墨烯纳米复合凝胶球的方法。包括：在酸性、碱性或中性水溶液中,加入氧化石墨烯、海藻酸钠和二价金属碳酸盐,通过超声和搅拌形成均匀混合溶液。将上述溶液逐滴滴入酸性溶液中,温度为18℃～100℃,即可获得多孔海藻酸盐-石墨烯纳米复合凝胶球。本发明制备的多孔海藻酸盐-石墨烯复合凝胶球比不造孔的凝胶具有更高的比表面积,进一步提高了材料在吸附领域的应用前景。",中国专利,,CNKI
Patent,1,李伟;王明宇;岳远志;王柏臣;马克明;任荣;卢少微,马来酸酐修饰的氧化石墨烯/双马来酰亚胺纳米复合材料的制备方法,110136 辽宁省沈阳市道义经济开发区道义南大街37号,2016-01-06,CN105218815A,发明专利,"本发明属于纳米材料技术领域,具体涉及一种马来酸酐修饰的氧化石墨烯/双马来酰亚胺纳米复合材料的制备方法。该方法是在溶剂中,采用马来酸酐对氧化石墨烯进行表面修饰,在氧化石墨烯表面引入能与树脂基体进行化学反应的双键基团,然后将马来酸酐修饰的氧化石墨烯加入到液态的O,O′-二烯丙基双酚A(DBA)中,经超声分散后,加入双马来酰亚胺基二苯甲烷树脂(BDM)进行反应,生成石墨烯改性的双马来酰亚胺树脂纳米复合材料。用本发明所述方法所得的纳米复合材料,可有效改善双马来酰亚胺树脂的韧性和强度,进一步提高双马来酰亚胺复合材料的综合性能。本发明制备的纳米复合材料可以广泛应用于航空航天、汽车船舶、机械电子等诸多领域,...",中国专利,,CNKI
