RT,SR,A1,T1,AD,FD,ID,CL,AB,DB,LA,DS
Patent,1,万传云;赵亮亮;张甜甜,一种石墨烯及其制备方法,200235 上海市徐汇区漕宝路120-121号,2016-01-27,CN105271208A,发明专利,"本发明属于材料制备技术领域,具体为一种石墨烯及其制备方法。本发明以石墨为原料,采用电解与液相氧化还原相结合的方法来大量合成氧化石墨烯,然后采用混合碱低温处理氧化石墨烯以制备具有可溶性的石墨烯。该制备方法,工艺简单,设备要求低,与传统的水合肼还原相比,安全环保,具有更广阔的应用前景。",中国专利,,CNKI
Patent,1,曲良体;崔琳凡;薛江丽;张志攀;赵扬;王忠辉,一种石墨烯薄膜和连续生产石墨烯薄膜的方法及装置,100081 北京市海淀区中关村南大街5号1区689楼1198,2016-01-27,CN105271209A,发明专利,"本发明公开了一种石墨烯薄膜和连续生产石墨烯薄膜的方法及装置。该方法包括：(1)将氧化石墨烯溶液喷涂在连续移动的金属箔上,同时加热所述金属箔以使所述氧化石墨烯溶液成膜并至少部分进行还原,得到涂覆氧化石墨烯层的金属箔,所述氧化石墨烯层还含有石墨烯；(2)所述涂覆氧化石墨烯层的金属箔连续移动通过刻蚀溶液进行金属箔刻蚀,得到氧化石墨烯薄膜；(3)将所述氧化石墨烯薄膜连续移动经过清洗和干燥后,进行退火以完全转变为石墨烯薄膜。该方法可以连续制备具有良好柔韧性和导热性的石墨烯薄膜,可作为高性能导热材料。",中国专利,,CNKI
Patent,1,陈庆;曾军堂;叶任海;陈兵,一种通过热塑化石墨材料制备石墨烯的方法,610091 四川省成都市青羊区蛟龙工业港东海路4座,2016-01-27,CN105271210A,发明专利,"本发明提供一种通过热塑化石墨材料制备石墨烯的方法,属于石墨烯材料领域。该方法是将石墨进行热塑化处理,通过端羟基聚合物增加石墨的层间距,削弱石墨的层间范德华力,使其在螺杆挤出机中加工时具有热塑流动性和柔性,通过螺杆旋转的剪切应力,使石墨延展薄层化,特别是热塑性石墨含有的极性高分子聚合物、端羟基聚合物碳化后,在螺杆的强力剪切作用下,薄层化的石墨被螺杆剪切定向剥离获得石墨烯,避免了石墨烯层结构的损伤,较好地保存了石墨烯的晶格完整性,从而获得大尺寸面积的高质量石墨烯。这种通过热塑化石墨再利用螺杆挤出机剥离制备石墨烯的方法更具有工业化前景和适合大规模化生产,具有显著的市场应用价值。",中国专利,,CNKI
Patent,1,郭慧;刘斌;金兆国;赵英民;裴雨辰,一种石墨烯气凝胶材料及其制备方法,100074 北京市丰台区7203信箱19分箱,2016-01-27,CN105271212A,发明专利,"本发明公开了一种石墨烯气凝胶材料及其制备方法,所述方法包括如下步骤：(1)制备前驱体溶液：将氧化石墨烯和骨架填料混合并搅拌均匀,得到前驱体溶液；(2)制备石墨烯水凝胶：向所述前驱体溶液添加催化剂并搅拌均匀,然后倒入放置有增强纤维的模具中并密封,将模具加热反应,得到纤维增强的石墨烯水凝胶；(3)制备石墨烯酮凝胶：将所述石墨烯水凝胶置于丙酮溶液中进行溶剂置换,得到石墨烯酮凝胶；(4)制备石墨烯气凝胶：将所述石墨烯酮凝胶取出并干燥,得到纤维增强的石墨烯气凝胶材料。本发明还涉及由所述方法制得的石墨烯气凝胶材料,该材料具有低热导率和高强度,可作为高温隔热材料使用。",中国专利,,CNKI
Patent,1,王珊;赵艳芬;苏正涛;王鹏,一种含石墨烯的耐磨氟橡胶及其制备方法,100095 北京市海淀区北京81信箱,2016-01-20,CN105255073A,发明专利,"本发明涉及橡胶材料领域,涉及一种含石墨烯的耐磨氟橡胶及其制备方法,尤其涉及是一种由石墨烯、纳米金刚石粉和氟橡胶共同组成的复合材料。所述的耐磨氟橡胶材料组成包括氟橡胶、石墨烯、纳米金刚石粉、填料,采用机械共混的方法制备。本发明的一种含石墨烯的耐磨氟橡胶材料极大的提高了现有氟橡胶的力学性能、耐磨性能,降低了材料的表面摩擦系数,同时具有更好的气体阻隔性能和导热性能。",中国专利,,CNKI
Patent,1,屈杨,一种石墨烯的氧化-还原制备方法,230000 安徽省合肥市新站区瑶海工业园纬D路7号,2016-01-27,CN105271214A,发明专利,"本发明公开了一种石墨烯的氧化-还原制备方法,将一定量的天然鳞片石墨粉浸没在浓酸中；容器转移到低温环境下,加入磷酸,搅拌,再加入强氧化剂,控制反应体系温度不高于5℃；将容器转移到室温环境下,搅拌；加热升温,搅拌反应6～12h,加水稀释,再加入双氧水和盐酸,超声,得到氧化石墨烯酸性溶液；向上述氧化石墨烯酸性溶液中加锂电池集流体铝箔碎屑,加热升温启动还原反应,搅拌,除去杂质,真空干燥即得。本发明通过锂电池集流体铝箔碎屑直接还原氧化石墨烯酸液得到石墨烯,简化实验工艺、缩短实验周期、减少杂质引入,避免采用高危险性、环境不友好性原材料,达到安全和环保的目的,同时回收再利用避免了资源浪费,降低了实验室成本。",中国专利,,CNKI
Patent,1,曲良体;王霄鹏;张志攀;赵扬;王忠辉,一种高密度氮掺杂石墨烯及其制备方法和应用,100081 北京市海淀区中关村南大街5号1区689楼1198,2016-01-27,CN105271215A,发明专利,"本发明涉及功能材料领域,公开了一种高密度氮掺杂石墨烯及其制备方法和应用,该制备方法包括：(1)在溶剂存在下,将氮源和氧化石墨烯进行接触；(2)将经过步骤(1)得到的产物进行干燥；(3)将经过步骤(2)干燥后得到的产物进行还原。本发明提供的所述高密度氮掺杂石墨烯兼具高质量比容量及体积比容量,而且,本发明提供的制备所述高密度氮掺杂石墨烯的方法简单,适合工业化大生产。",中国专利,,CNKI
Patent,1,谭月明;邓文芳;彭淑琴;张友明;蒋红梅,一种氮掺杂的三维石墨烯的制备方法,410006 湖南省长沙市岳麓区麓山路36号湖南师范大学化学化工学院,2016-01-27,CN105271217A,发明专利,"一种氮掺杂的三维石墨烯的制备方法,包括以下步骤：(1)将含氮有机聚合物和过渡金属的硝酸盐以质量比为0.2～5.0:1的比例混合,碾磨,然后在惰性气体气氛下,以5～15#℃/min的速率升温至800～1200℃,碳化4～6#h,冷却至室温,得石墨烯-金属复合物；(2)将步骤(1)所得石墨烯-金属复合物置于酸性溶液中搅拌24～72#h,过滤,洗涤,干燥,得氮掺杂的三维石墨烯。按照本发明方法所得氮掺杂的三维石墨烯具有三维多孔结构,比表面积大,氮含量高,导电性好,电催化性能与商品铂碳相近；本发明方法简单,成本低,适宜于工业化生产；所得氮掺杂的三维石墨烯可广泛应用于能源、环境、传感和生物分析等领域。",中国专利,,CNKI
Patent,1,蒋磊;张丽;郑肖;邱玉飞,一种氧化石墨烯发泡材料及其制备方法,315100 浙江省宁波市鄞州区望春工业园区杉杉路169号,2016-01-20,CN105255085A,发明专利,"本发明公开了一种氧化石墨烯发泡材料,它是由下述重量份的原料组成的：氧化石墨烯17-20、超细聚甲基丙烯酸甲酯粉130-150、葡萄糖0.1-0.3、聚甘油脂肪酸酯2-3、肉豆蔻醇1-2、硅烷偶联剂KH560#0.7-1、氟硅酸钠0.7-1、对硝基酚磷酸钠1-2、柠檬酸三丁酯6-10、发泡分散液10-13、竹炭粉2-4、异辛酸锰1-2、sp-80#0.4-1。本发明采用发泡分散液进行发泡,一改传统采用固体剂发泡的方式,不仅有效的解决了发泡剂容易团聚的问题,提高了在树脂基材中的分散性,极大的降低了发泡剂在树脂中残留或者产生副产品的机会,保持了树脂制品的老化性,还可以有效的避免因此而导致的模具排气孔...",中国专利,,CNKI
Patent,1,张弛;王爱健;宋京宝;虞王;钱军;龙凌亮,锡卟啉轴向共价功能化还原氧化石墨烯的非线性光学材料及其制备方法,212013 江苏省镇江市京口区学府路301号,2016-01-20,CN105254640A,发明专利,"本发明属于军工强激光防护材料领域,具体公开了一类具有较好非线性吸收性能的有机过渡金属锡卟啉轴向功能化的还原氧化石墨烯纳米杂化光敏功能材料,以及制备这些有机-无机共价功能化纳米材料的方法。本发明目的是针对石墨烯溶解性较差、分散稳定性差和目前强激光防护材料的局限,开发具有良好溶解性的新型卟啉共价石墨烯类非线性吸收材料。本发明通过采用1,3-偶极环化加成和自由基加成将有机过渡金属锡卟啉共价轴向键连在还原氧化石墨烯表面,通过二者之间的协同效应,改善石墨烯的溶解性和分散稳定性以及增强其非线性吸收性能,而不是两类不同光学功能材料简单的物理混杂,所得材料的非线性光学性能和溶解性能得到显著提高,具有良好的应用...",中国专利,,CNKI
Patent,1,马乐;郑逸群;孟良,石墨烯防PM2.5口罩滤片功能层及其在滤片中的应用,266111 山东省青岛市高新技术产业开发区创业中心112-E室,2016-01-27,CN105268327A,发明专利,"本发明属卫生保健范畴,特别是涉及一种石墨烯防PM2.5口罩功能层与制备方法以及其在滤片的应用。一种防PM2.5用口罩滤片功能层,所述滤片功能层为活性炭添加石墨烯。本发明口罩能够更有效地吸附PM2.5、附能力更强、抗菌抑菌、无需纺丝,制备工艺得到简化,更利于工业化生产。",中国专利,,CNKI
Patent,1,郭瑞;王宝亮;冯晓伟;岳华君;赵飞;赵凤瑞,一种聚偏氟乙烯/氧化石墨烯复合超滤膜的制备方法,030003 山西省太原市不锈钢产业园区C区1号2号厂房A区,2016-01-27,CN105268333A,发明专利,"本发明涉及一种聚偏氟乙烯/氧化石墨烯复合超滤膜的制备方法,①准确称量一定质量的氧化石墨烯,将其分散在N,N-甲基乙酰胺溶液中,超声处理至少10小时,获取充分剥离的散液；②将聚偏氟乙烯粉末于70℃下搅拌溶解在N,N-甲基乙酰胺溶液中,将氧化石墨烯分散液与聚偏氟乙烯铸膜液混合,搅拌24小时,并超声2小时；③将铸膜液置于真空环境中充分脱气,使用刮膜器准确的在一定尺寸的玻璃板上平铺200μm厚的铸膜液,在空气中停留20秒,将玻璃板浸入凝固浴中,其中凝固浴为20℃的去离子水,完成相转化过程；④对所制备的复合膜进行清洗,以去除残留的溶剂。本发明对聚偏氟乙烯膜材料进行改性,以提高膜的应用性能。",中国专利,,CNKI
Patent,1,高慧俐;涂铭旌;陈锐强,新型石墨烯散热膜喷涂装置,518055 广东省深圳市南山区留仙大道1183号南山云谷3栋7楼A5,2016-01-20,CN204974316U,实用新型,"本实用新型公开了一种新型石墨烯散热膜喷涂装置,包括注射泵、超声喷枪、空压机、加热台和二维运动平台,注射泵和超声喷枪通过导管相连通,超声喷枪和空压机通过导管相连通,加热台位于二维运动平台的上方,超声喷枪位于加热台的上方。本实用新型采用超声喷枪代替常规的石墨烯喷涂装置中的高压喷枪,喷涂过程中完成超声分散,防止沉底团聚,并且比普通喷枪最大优点在于不易堵喷枪口；采用注射泵代替蠕动泵,能够使喷涂装置运行的更加稳定；由于采用了超声喷枪,所以本装置可以采用占地面积较小的小型的空压机,从而节省占地面积。",中国专利,,CNKI
Patent,1,冯琳;刘娜;张玮峰;张淼;曹莹泽;陈雨宁;林鑫;许亮鑫;危岩,一种还原氧化石墨烯乳液分离薄膜及其制备方法与应用,100084 北京市海淀区北京市100084信箱82分箱清华大学专利办公室,2016-01-20,CN105251373A,发明专利,"本发明公开了一种还原氧化石墨烯乳液分离薄膜及其制备方法与应用。制备方法包括如下步骤：1)将氧化石墨烯、还原剂和缓冲溶液混合进行反应,得到反应后所得溶液；2)对反应后所得溶液依次进行真空抽滤、干燥,得到还原氧化石墨烯乳液分离薄膜。该薄膜可用于纳米级/亚微米级的多种类型的水包油型的乳液分离,并具有的分离效率高、可重复使用、自支撑等优点。其还具有超亲水/水下超疏油的特殊浸润性质,具有耐强酸、弱碱和高盐环境的性能,具有很好的稳定性,可多次循环使用。采用贻贝类仿生方法合成,原料温和、无毒、易得,制备过程简单、省时省力,实现在多种滤膜基底上制备乳液分离薄膜,可以进行大规模生产和应用。",中国专利,,CNKI
Patent,1,王勇;戴剑;杨静晖;黄婷;张楠,一种氧化石墨烯/聚多巴胺复合气凝胶的制备方法,610031 四川省成都市二环路北一段111号,2016-01-20,CN105254916A,发明专利,"一种氧化石墨烯/聚多巴胺复合气凝胶的制备方法,步骤如下：A、将0.15-0.7g多巴胺粉末溶于10-18ml蒸馏水中,在室温下与50-60ml浓度为5-6mg/ml的氧化石墨烯水溶液进合,搅拌得到氧化石墨烯/多巴胺混合溶液；B、边搅拌边在混合溶液中逐滴加入3-9mL浓度为0.1-0.12mol/L的三羟甲基氨基甲烷的缓冲液,继续搅拌2-2.5h；然后静置使多巴胺充分聚合,得到氧化石墨烯/聚多巴胺复合材料水凝胶；C、将复合材料水凝胶置于-20～-10℃环境下冷冻24-30h后,冷冻干燥处理,即得氧化石墨烯/聚多巴胺复合气凝胶。该方法工艺简单,制备的复合气凝胶孔隙率高、吸附性优异、强度高等优点。",中国专利,,CNKI
Patent,1,黄志雄;王富忠;张光武;戴ﾭZ,一种石墨烯纸预浸料的制备方法,430070 湖北省武汉市洪山区珞狮路122号,2016-01-20,CN105254920A,发明专利,"本发明为一种石墨烯纸预浸料的制备方法,包括以下步骤：配置石墨烯溶液,超声处理,得到分散均匀的石墨烯悬浮液；采用微孔滤膜真空过滤,过滤后,将石墨烯膜材料连同滤纸干燥,随后将滤物从微孔滤膜上揭下,然后热处理以去除分散剂,从而得到自支撑的石墨烯纸状材料；将所得的自支撑的石墨烯纸状材料置于环氧树脂和溶剂的混合液中浸渍；置于通风厨中,加热,得到树脂浸渍的石墨烯纸预浸料。本发明具有以下优点：使石墨烯材料能够大规模得应用于复合材料领域；可以有效得避免石墨烯的团聚,过滤后得到石墨烯片层取向度较好的石墨烯纸。经过热处理之后,能够比较容易得清除掉分散剂；预浸料固化后保持了石墨烯的优异导电性能。",中国专利,,CNKI
Patent,1,张建刚;张重静;王兰芳,一种导电导热石墨烯浆料及其制作方法,315000 浙江省宁波市江东区樟树街708号,2016-01-20,CN105255422A,发明专利,"本发明公开了一种导电导热石墨烯浆料,属于粘胶剂技术领域,其技术要点包括石墨烯5-18份、碳纳米管2-12份、离子液体5-35份、氧化铟1-5份、四氧化三铁1-6份、氧化铟锡1-3份、氧化锌3-6份、金属粉9-35份、环氧树脂12-40份、环氧稀释剂1-2份、固化剂2-5份、偶联剂0.01-0.5份。本发明制备的高导热的石墨烯导电胶能在大福度提高导电胶的导热性能的同时,不降低导电性能,从而解决导电胶高导电性、优异的力学强度与导热性能同时存在的技术问题,本发明制备的导电胶能够广泛应用在大功率器件中。",中国专利,,CNKI
Patent,1,闵永刚;张栋;莫申斌;申佳欣;赵春燕,一种氧化石墨烯纤维及其制备方法,210038 江苏省南京市栖霞区新港开发区恒达路3号紫金科创高通特别社区,2016-01-20,CN105256408A,发明专利,"本发明属于氧化石墨烯复合材料制备的技术领域,具体涉及一种氧化石墨烯纤维及其制备方法,包括以下步骤：步骤1,以氧化石墨烯为原料,将氧化石墨烯水分散液置于油浴锅中,在一定温度下搅拌浓缩到粘稠状,得浓缩氧化石墨烯；步骤2,配置浓度适宜的离子液水溶液；步骤3,以离子液水溶液为凝固液,通过湿法纺丝技术制备氧化石墨烯纤维。本发明以有机物的离子液在氧化石墨烯片层间产生连接来代替以往的金属离子的片层间连接。本发明操作简单,绿色环保,成本低廉,并且可以快速大量生产,制备的氧化石墨烯纤维在抗拉强度和稳定性上都不输以往的凝固液,可将此方法广泛应用到氧化石墨烯、石墨烯材料的改性等领域。",中国专利,,CNKI
Patent,1,慈立杰;姜宗清;刘克;丁显波;王凤鸣;茆胜,一种石墨烯散热涂料及其制备方法和应用,518000 广东省深圳市福田区上步中路1003号深圳市科学馆三楼,2016-01-27,CN105273540A,发明专利,"本发明公开了一种石墨烯散热涂料,其包括如下重量份数的组分：高分子树脂：40-80份；石墨烯：5-15份；一维碳纳米材料：1-8份；导热金属粉：1-8份；分散剂：0.5-5份；消泡剂：0.5-5份；惰性溶剂：100-200份；所述导热金属粉选自银粉、铜粉和铝粉中的至少一种,且粒度为1-20μm,上述涂料具有良好的散热导热功能。本发明还公开了该石墨烯散热涂料制备方法,其主要包括搅拌、研磨、再混合过程,操作简单,成本较低。上述石墨烯散热涂料因为其良好的导热散热功能,所以主要应用于日常电子产品散热,也可用于要求较高的航天电子器件上。",中国专利,,CNKI
Patent,1,刘振国,一种金属用石墨烯分散涂料及其制备方法,246600 安徽省安庆市岳西县莲云经济开发区,2016-01-27,CN105273607A,发明专利,"本发明公开了一种金属用石墨烯分散涂料,它是由下述重量份的原料组成的：石墨烯20-30、藻酸丙二醇酯6-11、氯铂酸0.01-0.02、二苯基甲烷二异氰酸酯600-700、全氟烷基乙基醇340-370、聚四氢呋喃醚二醇450-490、1,4-丁二醇1-2、二苯基硅二醇2-3、偏硼酸铵1-2、4-乙烯基环氧环己烷1.3-2、纳米二氧化硅90-100、含氢硅油16-20、羟基锡酸锌1-2、甲醇2-3、十二烷基硫醇1-2、生石灰4-7。本发明采用纳米二氧化硅与石墨烯共混,可以改善粒子在树脂间的分散性,提高涂膜的稳定性、表面强度。",中国专利,,CNKI
Patent,1,周永华;沈文中;黎伟,一种石墨烯功能润滑油的制备方法,400039 重庆市九龙坡区科城路71号、71号附1号二郎留学生创业园D1楼6楼,2016-01-20,CN105255547A,发明专利,"本发明公开一种石墨烯功能润滑油的制备方法,包括以下步骤：S1、将醋酸锌和硫代乙酰胺分别溶于水中配成溶液；S2、将醋酸锌溶液和硫代乙酰胺溶液与二烷基二硫代磷酸酯和水合联氨混合反应,再将得到的沉淀物分离、洗涤、干燥,得到二烷基二硫代磷酸酯修饰的纳米硫化锌；S3、将纳米石墨烯、纳米二硫化钼和纳米硼酸盐与偶联剂搅拌混合,得到偶联剂改性的纳米复合粉体；S4、将步骤S2得到的二烷基二硫代磷酸酯修饰的纳米硫化锌添加到基础油中,将步骤S3得到的偶联剂改性的纳米复合粉体添加到基础油中,在一定温度下高速搅拌后恢复至常温即可得到石墨烯功能润滑油。本发明制备的润滑油具有更优异的减摩抗磨性能、高承载能力,对磨损表面具有...",中国专利,,CNKI
Patent,1,何丹农;卢静;李争;张彦鹏;尹桂林;金彩虹,一种氧化石墨烯@Ag纳米颗粒拉曼增强基底的制备方法,200241 上海市闵行区江川东路28号,2016-01-27,CN105277529A,发明专利,"本发明涉及了一种氧化石墨烯@Ag纳米颗粒拉曼增强基底的制备方法,具体涉及到将氧化石墨烯超声分散去离子水中,PEI溶于去离子水中并加入氧化石墨烯溶液,超声搅拌后采离心提纯得到氧化石墨烯/PEI复合物；配置一定浓度的硝酸银溶液,加热至沸腾后加入柠檬酸钠溶液5持续搅拌后自然冷却,超声后用去离子水清洗得到Ag溶胶溶液；取氧化石墨烯/PEI溶液加入到步骤Ag溶胶中,静置后洗涤并溶于去离子水中,即获得氧化石墨烯@Ag纳米颗粒拉曼增强基底。",中国专利,,CNKI
Patent,1,杨志;孙震;汤雪辉;王涛;魏浩;张亚非,一种氧化锌纳米线-石墨烯气体传感器及其制备方法,200240 上海市闵行区东川路800号,2016-01-20,CN105259218A,发明专利,"本发明公开了一种氧化锌纳米线-石墨烯气体传感器及其制备方法,属于气体检测技术领域。气体传感器由基底、叉指电极和气敏涂层组成,其中气敏涂层是氧化锌纳米线-石墨烯复合材料。传感器制备过程分为：1)制备氧化锌纳米线和石墨烯纳米复合材料；2)采用微机械加工方法在基底上加工制备叉指电极,再在其表面覆盖一层纳米复合材料作为气敏涂层,组成传感器件。气体传感器在室温下对氨气的检测下限达到了50ppb,同时具有较短的响应时间、较强的重复稳定性和较好的气体选择性。此气体传感器适合在室温下对氨气进行高灵敏度的检测。",中国专利,,CNKI
Patent,1,魏琴;范大伟;胡丽华;马洪敏;曹伟;吴丹;庞雪辉;罗川南,一种基于花状金铂-花状二氧化铈-氧化石墨烯构建的呕吐霉素传感器的制备方法及应用,250022 山东省济南市济微路106号,2016-01-20,CN105259223A,发明专利,"本发明涉及一种基于花状金铂-花状二氧化铈-氧化石墨烯构建的呕吐霉素传感器的制备方法及应用,属于新型功能材料、生物传感检测技术领域。基于花状金铂-花状二氧化铈-氧化石墨烯对双氧水有良好的电化学催化能力和电子转移能力,显著提高了生物传感器的灵敏度,对粮食中呕吐霉素的检测具有重要的意义。",中国专利,,CNKI
Patent,1,王友清;沈常宇;楼伟民;申屠锋营;刘桦楠;魏健,基于氧化石墨烯和琼脂糖复合膜的倾斜光纤光栅湿度传感器,310018 浙江省杭州市下沙高教园区学源街258号,2016-01-20,CN105259139A,发明专利,"本发明将经过干燥处理的氧化石墨烯/琼脂糖混合溶液均匀的镀在倾斜光纤光栅的栅区侧表面,从而形成一种新型的镀有氧化石墨烯/琼脂糖复合薄膜的光纤光栅湿度传感器,属于光纤传感技术领域。氧化石墨烯/琼脂糖复合薄膜具有吸湿膨胀和干燥消溶胀的特性,相应的薄膜折射率也会发生变化,结合倾斜光纤光栅对周围折射率变化特别敏感的特性,制作成基于氧化石墨烯/琼脂糖复合膜的倾斜光纤光栅湿度传感器。同时,倾斜光纤光栅对温度不敏感的特性,可消除温度的交叉敏感。",中国专利,,CNKI
Patent,1,曲良体;董立业;陈南;胡传刚;王忠辉,用于阻燃复合材料的组合物和氧化石墨烯阻燃薄膜及其制备方法和应用,100081 北京市海淀区中关村南大街5号1区689楼1198,2016-01-27,CN105273727A,发明专利,"本发明涉及功能材料领域,公开了一种用于阻燃复合材料的组合物和氧化石墨烯阻燃薄膜及其制备方法和应用。所述用于阻燃复合材料的组合物中含有阻燃剂和氧化石墨烯,以所述组合物的总量为基准,所述阻燃剂的含量为3-45重量％,所述氧化石墨烯的含量为55-97重量％。本发明提供的所述氧化石墨烯阻燃薄膜热稳定性好、阻燃性能好、形变小且拉伸强度大。本发明提供的氧化石墨烯阻燃薄膜还能够用于火灾警报装置领域。",中国专利,,CNKI
Patent,1,邢宏龙;尹清;刘振峰;王磊,一种还原氧化石墨烯和纳米氧化铈复合的微波吸收材料及制备方法,232001 安徽省淮南市舜耕中路168号,2016-01-20,CN105255446A,发明专利,"本发明具体涉及一种还原氧化石墨烯和纳米氧化铈复合的微波吸收材料及制备方法,以改进的Hummers法制备氧化石墨烯,将氧化石墨烯水溶液与硝酸铈按质量比1:25混合,同时调节pH为10,采用一步水热法,在生成纳米氧化铈的同时将氧化石墨烯还原,制得还原氧化石墨烯和纳米氧化铈复合的微波吸收材料。采用矢量网络分析仪测试复合材料的微波吸收参数,通过经典的同轴线理论计算复合材料的微波反射损耗。结果表明,还原氧化石墨烯/纳米氧化铈复合的微波吸收材料具有优异的微波吸收性能,吸收强度高,吸收频带宽,与纳米氧化铈相比,吸波性能大幅度提高。因此,本发明具有广阔的应用前景,对拓展稀土氧化物的工业应用以及国防建设具有极其...",中国专利,,CNKI
