RT,SR,A1,T1,AD,FD,ID,CL,AB,DB,LA,DS
Patent,1,李云兴;吴正峰;仇季;张俊芬,一种制备聚苯乙烯/石墨烯/贵金属复合粒子的方法,214122 江苏省无锡市蠡湖大道1800号江南大学化学与材料工程学院,2016-05-04,CN105542332A,发明专利,"本发明提供了一种制备聚苯乙烯/石墨烯/贵金属复合粒子的方法,所述方法包括：(1)采用未经表面改性与修饰的聚苯乙烯微球,用水配制成聚苯乙烯微球分散液；(2)将氧化石墨分散在水中,经超声剥离,得到氧化石墨烯水分散液；(3)搅拌下,将氧化石墨烯水分散液加入到聚苯乙烯微球水分散液中,升温至80-100℃,加入水合肼,反应45-150分钟,经离心、洗涤,得到聚苯乙烯/石墨烯复合粒子的水分散液；其中,水合肼与氧化石墨烯的质量比100∶1-5,和(4)在聚苯乙烯/石墨烯复合粒子的水分散液中,加入贵金属前驱体,在20-100℃下反应30-120分钟,然后经离心、洗涤,得到聚苯乙烯/石墨烯/贵金属复合粒子。该方...",中国专利,,CNKI
Patent,1,关伟;杜鹃;罗艳;钟毅;李增宏,一种还原氧化石墨烯复合薄膜及其制备方法,201620 上海市松江区松江新城区人民北路2999号,2016-05-04,CN105542333A,发明专利,"本发明涉及一种还原氧化石墨烯复合薄膜及其制备方法,该方法包括(1)改进Hummer法制备低氧化石墨水溶液；(2)低氧化氧化石墨烯/两亲性聚合物分散液的制备；(3)分级离心；(4)原位聚合；(5)抽滤成膜；(6)制备复合膜；(7)还原；在70-80℃条件下,将复合膜浸泡在HI水溶液中10～15s,取出,然后清洗和干燥；即得到还原氧化石墨烯复合薄膜。本发明制备的还原氧化石墨烯复合薄膜5×5cm无任何裂缝和褶皱,0-180°任意弯曲,在λ＝550nm处透光率85％-88％,电导率达到91.6-98.2S/cm,表面电阻为145.82-175.54Ωsq-1；拉曼光谱显示,HI还...",中国专利,,CNKI
Patent,1,宋来洲;杨育林;韩康达;张英莉;左镇;李飞,α-二氧化锰-石墨烯-聚四氟乙烯耐磨减摩复合材料的制备方法,066004 河北省秦皇岛市海港区河北大街西段438号,2016-05-04,CN105542372A,发明专利,"一种α-二氧化锰-石墨烯-聚四氟乙烯耐磨减摩复合材料的制备方法,其主要是首先制备了纳米石墨烯,并对其进行氨基化处理,然后将聚四氟乙烯粉末通过等离子体处理后接枝丙烯酸,之后应用水热合成技术制备了纳米α-二氧化锰-石墨烯复合材料,最后制得了制备α-二氧化锰-石墨烯-聚四氟乙烯耐磨减摩复合材料所用的混合粉末,并对混合粉末进行冷模压成型和系列热处理,制备了α-二氧化锰-石墨烯-聚四氟乙烯耐磨减摩复合材料。应用本发明技术制备的复合材料具有摩擦系数小、磨损率低、机械强度大、热稳定性高、使用寿命长的优点,其可应广泛用于化工、机械、航空航天等领域。",中国专利,,CNKI
Patent,1,曹明莉;盛智博;张会霞,吸附重金属离子的石墨烯水泥基材料及其制备方法,116024 辽宁省大连市甘井子区凌工路2号,2016-05-04,CN105536702A,发明专利,"吸附重金属离子的石墨烯水泥基材料及其制备方法,属于复合材料技术领域。所用原料为功能化的石墨烯、水泥、砂子和水。将称量好的功能化石墨烯加入到水中,超声处理30min,依次加入水泥、砂子到搅拌锅中,搅拌；之后装模成型、养护得到成型的石墨烯水泥基材料成品。本发明吸附污染水中的重金属离子的能力强,可用于排水管道、沟渠、人工河床底、污水沉淀池等处,可循环使用,绿色环保。",中国专利,,CNKI
Patent,1,于飞;李勇;孙赛楠;韩生;王娟,一种去除水溶液中环丙沙星的氧化石墨烯海藻酸钠复合吸附材料的制备方法,200235 上海市徐汇区漕宝路120-121号,2016-05-04,CN105536726A,发明专利,"本发明涉及一种去除水溶液中环丙沙星的氧化石墨烯海藻酸钠复合吸附材料的制备方法,包括以下步骤：将一定量的氧化石墨样品分散于去离子水中,放入超声清洗器中超声6-10h；将一定量海藻酸钠溶于超声之后的氧化石墨溶液,再超声20min；将上述混合液通过蠕动泵滴加至0.2mol/L氯化钙溶液中,浸泡1-3d后,去离子水清洗3-4次,即得到海藻酸钠氧化石墨烯球体水凝胶材料,冷冻干燥后,即制得氧化石墨烯海藻酸钠球体气凝胶；本发明在较温和的条件下进行,通过离子桥的方法将氧化石墨烯封装于海藻酸钠网络结构中,避免了石墨烯粉体的纳米毒性,制备出高效吸附水溶液中环丙沙星抗生素的新纳米材料,该制备工艺简单、条件易控、成本...",中国专利,,CNKI
Patent,1,张东;臧文婷,一种混杂三维网状石墨烯材料及其制造方法,200092 上海市杨浦区四平路1239号,2016-05-04,CN105540568A,发明专利,"本发明涉及一种混杂三维网状石墨烯材料及其制备方法,属于石墨烯纳米材料技术领域。本发明制备方法包括以下步骤：制备氧化石墨烯分散液和石墨烯纳米片分散液；使用溶液混合法,配制氧化石墨烯-石墨烯纳米片混合溶液,并超声处理,促进分散混合；取混合溶液,进行水热反应,得到混杂的三维网状石墨烯；对得到的三维网状石墨烯进行冲洗,并真空冻干处理。与现有技术相比,本发明得到的混杂三维网状石墨烯材料集高热导率、稳定性和易加工性等功能于一体。相比于其他石墨烯材料,混杂三维网状石墨烯制备工艺过程简单,成本低廉,绿色安全。",中国专利,,CNKI
Patent,1,郭丽萍;王虹;曹园章;孙伟,一种石墨烯水性稳定分散液的制备方法,211189 江苏省南京市江宁区东南大学路2号,2016-05-04,CN105540571A,发明专利,"本发明提供了一种石墨烯水性稳定分散液的制备方法,步骤为：(1)将分散剂加入水中,磁力搅拌2-3min直至分散均匀,其中,分散剂与水的质量体积比为0.5-5：10-100g/mL；(2)将石墨烯加入到配制好的分散液中,其中,石墨烯与步骤(1)中的水的质量体积比为0.1：10-100g/mL,然后磁力搅拌2-3min,超声分散1-10h,得到高分散性的稳定石墨烯水性分散液。本发明的制备过程中不采用浓酸及其他强氧化剂对石墨烯进行氧化,不会对石墨烯的物理化学性能造成损失,且不产生对环境有任何污染的废弃物。",中国专利,,CNKI
Patent,1,高超;陈琛;孙海燕,一种高溶解性多褶皱干态氧化石墨烯微球及其制备方法,310023 浙江省杭州市西湖区西溪路525号C楼715室,2016-05-04,CN105540573A,发明专利,"本发明公开了一种高溶解性多褶皱干态氧化石墨烯微球及其制备方法。这种干态氧化石墨烯是首先用有机溶剂稀释Hummers法制备得到的氧化石墨烯分散液,再进行雾化干燥得到。本发明得到的干态氧化石墨烯微球溶解性好,在水和常见有机溶剂中的溶解度为20～30mg/g,并且能以单层氧化石墨烯片的形式长期稳定分散；被压缩成高密度块体后仍保持良好溶解性；制备方法简便快捷、能耗低,适合大规模工业化生产。本发明解决了现有干燥方法得到的氧化石墨烯溶解性差的问题,较高的密度有利于其运输、储存和使用,可被用于石墨烯宏观组装材料,功能化石墨烯材料及石墨烯复合材料等领域。",中国专利,,CNKI
Patent,1,陈庆;叶任海,一种利用对喷式气流粉碎机制备石墨烯微片的方法,610091 四川省成都市青羊区蛟龙工业港东海路4座,2016-05-04,CN105540574A,发明专利,"本发明涉及石墨烯材料领域,具体涉及石墨烯微片的制备方法,特别是涉及一种利用对喷式气流粉碎机制备石墨烯微片的方法。通过熔融的氯化铁、氯化钾进入石墨的层间,利用氯化铁、氯化钾晶粒易脆断的特性,利用滑石粉流动性好、不易团聚的特性,在对喷式气流粉碎机中通过高速气流使粉料碰撞,产生的击力、剪切力、摩擦力将石墨和滑石粉剥层,进一步通过分级室分选,不合格粉料回流至粉碎室,已剥离的石墨和滑石粉与气体一起产出,获得石墨烯片。实现了连续、规模化生产层数分散均匀、流动性好、不易团聚的石墨烯微片,而且产量高、成本低,无污染,层厚满足在橡胶增强、塑料增强、涂料防腐、润滑、污水处理领域的使用要求,有利于推动石墨烯的大规模...",中国专利,,CNKI
Patent,1,陈庆;孙丽枝;陈兵,一种利用高压均质机剥离制备石墨烯的方法,610091 四川省成都市青羊区蛟龙工业港东海路4座,2016-05-04,CN105540575A,发明专利,"本发明属于石墨烯技术领域,特别涉及一种利用高压均质机剥离制备石墨烯的方法。通过对石墨原料进行插层改性处理,与分散剂混合形成分散浆料,将分散浆料送入高压均质机,利用高压流体在高速流动中产生的巨大剪切力和和流体碰撞产生的冲击压力快速剥离石墨,同时利用流体的高速流动,实现了石墨的逐层剥离,防止机械剪切力对石墨烯晶体结构的破坏,使制备的石墨烯晶格缺陷小、产品质量高,实现了高剪切机械条件下规模化生产高质量少层石墨烯。本发明方法制备的石墨烯产率高,层数在十层以内,结构缺陷小,分散性好,实现了快速、高效制备高质量石墨烯,大幅度降低了高质量石墨烯的生产成本,制备过程绿色环保,具有显著的市场价值。",中国专利,,CNKI
Patent,1,陈庆;叶任海;孙丽枝;陈兵,一种在干粉状态下通过多孔骨架固体强酸制备石墨烯的方法,610091 四川省成都市青羊区蛟龙工业港东海路4座,2016-05-04,CN105540576A,发明专利,"本发明公开了一种在干粉状态下通过多孔骨架固体强酸制备石墨烯的方法,采用多孔骨架的固体强酸作为氧化剂,将微细化的石墨粉通过高速气流的输送到达固体强酸的表面,使石墨粉被氧化,获得氧化石墨粉,再用高速气流将氧化石墨烯从多孔骨架的固体强酸表面剥离下来,获得氧化石墨烯干粉,再对氧化石墨烯还原获得石墨烯。整个工艺操作简单,避免了无机强质子酸的工作环境,以及避免了剧毒有机反应物的使用,对环境友好,具有宽广的市场应用价值。",中国专利,,CNKI
Patent,1,杨仁党;程峥;张优茂,一种氧化石墨烯复合气凝胶及其制备方法与应用,510640 广东省广州市天河区五山路381号,2016-05-04,CN105536774A,发明专利,"本发明属于多孔材料催化剂领域,具体公开了一种氧化石墨烯复合气凝胶及其制备方法与应用。所述制备方法为：将氧化石墨烯粉末与水按固液比为1:2～1:6混合,超声分散；然后在搅拌的条件下加入纳米级的MnO2粉末,接着进行水热反应,反应停止后冷却至室温,过滤并用水洗涤滤饼,干燥；得到的固体材料置于醇溶液中进行置换反应,得到氧化石墨烯复合水凝胶；最后将氧化石墨烯水凝胶冷冻干燥,然后冷却,得到氧化石墨烯复合气凝胶。本发明中催化剂制备方法简单,操作性强,稳定性高,且氧化石墨烯复合气凝胶催化臭氧化处理效果较好,为造纸废水的深度处理提供了有效的方法。",中国专利,,CNKI
Patent,1,张志颖;王玮;刘春艳,一种室温还原氧化石墨烯制备石墨烯及其复合材料的方法,100190 北京市海淀区中关村东路29号,2016-05-04,CN105540577A,发明专利,"本发明提供了一种室温还原氧化石墨烯制备石墨烯及其复合材料的方法,它包括如下步骤：将氧化石墨烯分散到去离子水中,得氧化石墨烯分散液；将催化剂分散到去离子水中,得催化剂分散液；将所述氧化石墨烯分散液和所述催化剂分散液混合,得到待还原液；将还原剂分散到所述待还原液中,在室温下发生还原反应,得粗产品；用永磁体将所述粗产品进行分离,然后将产物经过渗析处理,得到石墨烯。该方法也可用于由氧化石墨烯复合材料制备石墨烯复合材料。该方法条件温和,主要用于在室温、低还原剂浓度下石墨烯及其复合材料的制备领域,特别适合负载有对温度、还原剂敏感的生物活性材料负载的石墨烯复合材料的制备。",中国专利,,CNKI
Patent,1,唐利斌;姬荣斌;项金钟;高树雄,硫掺杂石墨烯量子点的共燃制备方法,650031 云南省昆明市五华区教场东路31号,2016-05-04,CN105540578A,发明专利,"硫掺杂石墨烯量子点的共燃制备方法,涉及石墨烯量子点的制备方法,尤其是一种采用价格低廉的液体石蜡和二硫化碳作为原材料,采用共燃法进行制备的硫掺杂石墨烯量子点的共燃制备方法。本发明的硫掺杂石墨烯量子点的共燃制备方法,通过异质硫原子的掺杂,来有效地调制石墨烯量子点的结构和能级,从而调制石墨烯量子点光电性质,其特征在于硫掺杂石墨烯量子点通过共燃、超声等制备方法得到。本发明的硫掺杂石墨烯量子点的共燃制备方法,整体技术路线创新,价格低廉,共燃法制备得到硫掺杂碳纳米球,再经过超声液相剥离,成功制备出硫掺杂石墨烯量子点,具有优异的光电性质,增加了石墨烯量子点的额外能级,有效地改变了石墨烯量子点的性能。",中国专利,,CNKI
Patent,1,高峰;胡宇;侯伟骜;王芦燕;崔云涛;李振铎,一种制备石墨烯的新方法,100160 北京市丰台区南四环西路188号总部基地十八区23号楼,2016-05-04,CN105540579A,发明专利,"本发明公开了一种制备石墨烯的新方法,属于材料技术领域,包括以下步骤：对天然鳞片石墨进行插层,制备可膨胀石墨,对可膨胀石墨进行团聚造粒,筛分获得球形粒径适宜的可膨胀石墨,对其进行等离子喷涂,在基材上得到石墨烯。本发明利用高能等离子焰流较普通加热方式更快地加热可膨胀石墨,使含氧官能团在极短时间内迅速分解,产生更高的冲击力,从而直接剥离石墨片层,免去了超声波分离等步骤,从而更快捷地获得大片层石墨烯。",中国专利,,CNKI
Patent,1,刘成伦;李辉;徐龙君,一种石墨烯复合磁性光催化剂Mn1-xZnxFe2O4/BiVO4/RGO的制备方法,400044 重庆市沙坪坝区沙坪坝正街174号,2016-05-04,CN105536810A,发明专利,"本发明涉及一种石墨烯复合磁性光催化剂Mn1-xZnxFe2O4/BiVO4/RGO的制备方法,属于无机光催化材料领域。将片层状石墨烯(RGO)和磁性Mn1-xZnxFe2O4颗粒负载在单斜BiVO4上形成的异质结复合光催化剂,具有强的导电能力,阻抗值(103Ω.cm2)明显小于BiVO4的阻抗值(351Ω.cm2...",中国专利,,CNKI
Patent,1,朱启安;王建霞;白杲;蒋叔立;杜寒宇;魏明杨,一种石墨烯/硫化锑复合光催化剂的制备方法,411105 湖南省湘潭市雨湖区羊牯塘27号,2016-05-04,CN105536819A,发明专利,"本发明公开了一种石墨烯/硫化锑复合光催化剂的制备方法。该方法是先将氧化石墨烯加入到去离子水中,超声分散,然后加入硫源,超声处理,再加入酒石酸锑钾,并磁力搅拌,得反应混合物；将反应混合物水热处理,冷却后,离心分离,得黑色沉淀；将黑色沉淀洗涤、干燥后得石墨烯/硫化锑复合光催化剂。该方法制得的石墨烯/硫化锑复合光催化剂复合效果好、可见光光催化活性高,能充分利用太阳光及室内自然光对环境污染物进行光催化降解。其具有生产工艺简单、生产过程绿色环保、反应参数容易控制、实施成本低、产品质量优良的优点,可广泛用于石墨烯基复合材料的制备。",中国专利,,CNKI
Patent,1,闵宇霖;周凡琪;李涛涛,石墨烯纳米带负载半导体的三维光催化材料的制备方法,200090 上海市杨浦区平凉路2103号,2016-05-04,CN105536840A,发明专利,"本发明涉及石墨烯纳米带负载半导体的三维光催化材料的制备方法,将二氧化钛前驱体溶解于过氧化氢与氨水混合溶液中,搅拌至溶液黄色澄清,加入氮化碳,待溶液浑浊,离心洗净,再加入去离子水和经过超声处理的石墨烯纳米带,搅拌后于反应釜中反应,再经过离心、洗净、烘干处理后,于氮气氛围下煅烧,即得到石墨烯纳米带负载的半导体三维光催化材料。与现有技术相比,本发明,制备工艺简单,有效提高了催化剂的活性和光催化性能,石墨烯纳米带的加入,使得该材料在可见光区域有了明显的响应。",中国专利,,CNKI
Patent,1,吉成胜,一种石墨烯复合材料及其制备方法,213000 江苏省常州市武进区西太湖科技产业园祥云路6号,2016-05-04,CN105536848A,发明专利,"本发明所述的一种石墨烯复合材料,包括氮掺杂还原氧化石墨烯和氮掺杂二氧化钛纳米线；所述二氧化钛纳米线的长径比大于10。本发明选取一维二氧化钛纳米线作为活性组分,二氧化钛纳米线不但具有更好的电子传输通道,有利于加速电子传输,提高反应速率。同时,一维二氧化钛纳米线还能更好的防止石墨烯片层的堆叠,更加有效的利用石墨烯大比表面的特性,增加反应接触面积,提高催化反应速率。本发明所述的一种石墨烯复合材料的制备方法,不但工艺简单、原料易保存、反应温和,而且能耗较低,适合工业应用。同时,先制备形貌可控的二氧化钛纳米线,再制备所述石墨烯复合材料,不但有效降低了生产成本,而且能够实现产品质量可控。",中国专利,,CNKI
Patent,1,尹海旭;殷恒波,一种石墨烯负载镍铜双金属催化剂催化转化甘油制取乳酸的方法,212013 江苏省镇江市京口区学府路301号,2016-05-04,CN105541608A,发明专利,"本发明涉及乳酸制备技术领域,特指一种负载镍铜双金属催化剂催化转化甘油制备乳酸的方法,乳酸的选择性可达98.3％,甘油转化率可达100％。其特征在于：是以生物质甘油为原料,反应温度在90～170℃,反应时间为1～2h,在以石墨负载双金属镍铜为催化剂下,在NaOH提供的碱性条件下由高纯氮气排空的高压反应釜中进行反应制取乳酸。所述石墨烯负载双金属镍铜催化剂具有反应温度、压力低,催化活性高,乳酸选择性高,以及价格低廉工艺过程安全环保等优点,具有良好的工业化前景。",中国专利,,CNKI
Patent,1,于淼;孙磊;杨晨辉;孙晔;李正林,成级别增长制备石墨烯量子点的方法,150001 黑龙江省哈尔滨市南岗区西大直街92号,2016-04-27,CN105523543A,发明专利,"成级别增长制备石墨烯量子点的方法,本发明属于碳材料科学领域,特别涉及一种制备石墨烯量子点的方法。本方法：一、将芳香族化合物加入硝酸中,加热,冷却至室温,加水,过滤,洗涤,干燥,得到黄色粉末；二、将黄色粉末加入到碱性物质中,超声中处理,然后倒入不锈钢反应釜中,密封,加热,自然冷却至室温后,过滤,取滤液倒入透析袋中,透析,干燥,得到石墨烯量子点；本发明先将萘硝基化,随后在碱性溶液中水热处理形成石墨烯量子点。该量子点尺寸小且易于分散,无团聚现象,随原料的加入量增加,产物的产量也相应地增加,本发明方法简单,条件温和,有利于未来大规模生产和应用。",中国专利,,CNKI
Patent,1,赵ﾵt松;孔莹;赵东林;姚冉冉;林欢,一种石墨烯的制备方法,100029 北京市朝阳区北三环东路15号,2016-04-27,CN105523545A,发明专利,"本发明公开了一种石墨烯的制备方法,属于材料技术领域。本发明以石墨化的中间相炭微球为原料,通过碳化和石墨化制备石墨化中间相炭微球,经过化学氧化制备氧化石墨烯,用热还原法制备层数可控的石墨烯。制备方法：采用改进的Hummers法将石墨化中间相炭微球氧化,通过超声、离心得到氧化石墨烯；惰性气氛下在管式炉中对氧化石墨烯进行高温热还原,产物经过过筛、超声以及干燥得到石墨烯。本发明提供的技术方案中采用了中间相炭微球作为原料,经过石墨化处理,使后续剥离方便,层数容易控制,所制得的单层石墨烯可达到90％以上,品质较高,制备工艺简单高效,得到的石墨烯层数在五层以下,产率较高。可在石墨烯及相关产品生产和应用中发挥...",中国专利,,CNKI
Patent,1,魏大程;亓国强;杨伟;夏冬云;李科;李孟林;刘冬华;曹敏;彭兰,一种三维石墨烯的制备方法,200433 上海市杨浦区邯郸路220号,2016-04-27,CN105523546A,发明专利,"本发明属于石墨烯制备技术领域,具体公开了一种三维石墨烯的制备方法。本发明方法包括以下步骤：将氧化石墨烯分散获得氧化石墨烯水溶液；将三维金属泡沫浸入氧化石墨烯溶液,通过物理或化学方法获得孔内负载有石墨烯气凝胶的三维金属泡沫；以孔内负载有石墨烯气凝胶的三维金属泡沫为模板,利用化学气相沉积法,得到含基底的三维石墨烯；通过刻蚀清洗得到三维石墨烯。本发明工艺简单,能实现高质量、高密度三维石墨烯,为其在催化、储能、导热、吸附等领域的应用奠定了基础。",中国专利,,CNKI
Patent,1,高超;彭蠡;姜炎秋;刘英军,一种超柔性高导热石墨烯膜及其制备方法,310058 浙江省杭州市西湖区余杭塘路,2016-04-27,CN105523547A,发明专利,"本发明公开了一种超高柔性石墨烯导热膜及其制备方法,该石墨烯膜由超大片均匀氧化石墨烯经过溶液成膜、化学还原、高温还原以及高压压制等步骤得到。石墨烯膜由具有微观尺度褶皱的宏观多层褶皱石墨烯通过物理交联组成,片层间可滑移,因此具有极高的柔性。其石墨烯片层结构完美,片层晶区极大(100um左右)并极少含有缺陷,经过高压压制后结构密实,具有超高的导电性和导热性。此高柔性石墨烯导热膜可耐反复弯折1200次以上,断裂伸长率为12-18％,导电率为8000-10600S/cm,热导率为1800-2600W/mK,可用作高柔性导热导电器件。",中国专利,,CNKI
Patent,1,高ￂQ;李占成;姜浩;史浩飞,一种控制石墨烯晶核生长的载具,400714 重庆市北碚区方正大道266号,2016-04-27,CN105523548A,发明专利,"本发明公开一种控制石墨烯晶核生长的载具。载具包括上盖、盒子和用于生长石墨烯的平直的金属基底,上盖上开有小孔,上盖和盒子均由石墨、石英、氮化硅或碳化硅等熔点大于1000摄氏度的耐高温材料制成；金属基底放置于盒子的底座上后金属基底与盖在盒子上的上盖下表面距离小于等于2mm。该载具的使用方法包括金属基底预处理、金属基底退火、石墨烯成核、冷却和氧化过程。本发明在成核阶段载具的开孔大小对反应气体的起到限流作用,可以控制石墨烯在铜箔上的成核区域和成核密度；通过开孔大小和各种生长参数控制减小石墨烯的成核密度从而实现大单晶石墨烯的制备；通过CVD管式炉控制气体比例和压强使石墨烯单晶或多晶面积长大。",中国专利,,CNKI
Patent,1,陈庆;孙丽枝;陈兵,一种用于机械剥离法制备石墨烯的剥离剂及应用,610091 四川省成都市青羊区蛟龙工业港东海路4座,2016-04-27,CN105523549A,发明专利,"本发明属于石墨烯技术领域,特别涉及一种用于机械剥离法制备石墨烯的剥离剂及应用。所述剥离剂按重量百分比由如下成分组成：70~80%的聚合有机质,5~15%的有机发泡剂和10~20%的载体。将上述组分在高速搅拌机中混合均匀,使聚合有机质和有机发泡剂和均匀负载在载体中,在机械剥离制备石墨烯的过程中,将剥离剂与石墨原料混合形成预混物,在机械剪切过程中,负载在无机层状载体中的发泡剂发泡产生剥离力,使石墨层间的间隙扩大,同时聚合有机质与石墨层间发生非共价作用,有利于降低石墨层间的作用力,同时还可以提高石墨烯的分散性。采用本发明剥离剂制备的石墨烯产率高,结构缺陷小,可以明显缩短机械剥离制备石墨烯的时间,具有...",中国专利,,CNKI
Patent,1,陈庆;叶任海,一种利用圆盘式气流粉碎机制备石墨烯微片的方法,610091 四川省成都市青羊区蛟龙工业港东海路4座,2016-04-27,CN105523550A,发明专利,"本发明涉及石墨烯材料领域,具体涉及一种利用圆盘式气流粉碎机制备石墨烯微片的方法。先将石墨粉进行热处理,然后利用插层剂对石墨烯进行预处理,减小石墨层之间范德华力,使石墨层更易被剥离,再将石墨粉加入圆盘式气流粉碎机中,在高速气流碰撞的中使石墨之间相互摩擦、碰撞,产生以剪切力为主的剪切力、摩擦力和撞击力,将石墨剥层,从而获得石墨烯微片。实现了连续、规模化生产层数均匀的石墨烯微片,而且产量高、成本低,无污染,层厚满足在橡胶增强、塑料增强、涂料防腐、润滑、污水处理领域的使用要求,有利于推动石墨烯的大规模应用。",中国专利,,CNKI
